02/11/2019 19:48,02/11/2019 20:00,0,99.117.140.149,100,677,1,02/11/2019 20:00,R_1CpyTSklq0nweQR,,,,,41.58779907,-87.45320129,anonymous,EN,,Benjamin,,,,"4,5,6,7,8,9",,,,,,,,,,,,,,,,,,,,,,,,,,,,,,,,,,,,,,,,,,,1,1,1,2,0,0,48.94,0,1,7,,,0,0,17.856,0,7,7,,,1,2,2,2,2,6.413,15.549,50.734,2,1,1,,,0,0,17.947,0,7,7,,,1,28,1,"Since both of the employees made coffee on Friday in the two videos, they are both responsible for causing a power failure.",,4,1
02/11/2019 19:53,02/11/2019 20:01,0,73.181.157.141,100,427,1,02/11/2019 20:01,R_OvatfL8BHQUWMWB,,,,,47.63000488,-122.2971954,anonymous,EN,,,,,James,"4,5,6,7,8,9",1,1,1,2,0,0,52.274,0,1,7,,,0,0,17.89,0,4,4,,,1,2,2,2,2,0,0,40.569,0,4,4,,,0,0,13.127,0,4,4,,,1,,,,,,,,,,,,,,,,,,,,,,,,,,,,,,,,,,,,,,,,,,,25,2,I made my judgments based on observation.,,1,1
02/11/2019 19:50,02/11/2019 20:02,0,107.77.228.57,100,695,1,02/11/2019 20:02,R_24ctW9xy70CzFNs,,,,,34.10040283,-118.2946014,anonymous,EN,,,Ava,,,"4,5,6,7,8,9",1,1,1,2,0,0,50.526,0,,,7,1,0,0,21.675,0,,,7,1,1,2,2,2,2,32.498,32.823,41.018,2,,,1,1,0,0,31.393,0,,,4,4,1,,,,,,,,,,,,,,,,,,,,,,,,,,,,,,,,,,,,,,,,,,,49,2,"In the first video the two gentlemen did not know each other or each other's habits, so they did not know that there was a chance both would use the microwave at the same time. In the second video the two gentleman new each other well, and each other's habits. So, Ben new very well that it was highly likely Tom would be using a microwave, and Ben still decided to use the microwave. ",no problems,2,2
02/11/2019 19:53,02/11/2019 20:03,0,108.233.81.229,100,610,1,02/11/2019 20:03,R_3hhA2mhpgLcB68A,,,,,37.68640137,-121.7653961,anonymous,EN,,Benjamin,,,,"4,5,6,7,8,9",,,,,,,,,,,,,,,,,,,,,,,,,,,,,,,,,,,,,,,,,,,1,1,1,2,0,0,49.77,0,,,5,2,0,0,15.75,0,,,6,2,1,2,2,2,2,0,0,34.813,0,,,2,2,0,0,14.889,0,,,2,7,1,45,2,"Since the same guy always made the coffee in the shared office, it was mostly the other employee's fault when he decided to make coffee on Friday in his own office. Similarly, the one guy never made coffee in his own office Monday through Thursday in the second scenario, so he was definitely to blame for the power outage when he suddenly decided to make coffee on Friday.",,3,2
02/11/2019 20:01,02/11/2019 20:13,0,68.126.220.214,100,675,1,02/11/2019 20:13,R_1GO15Fm78bJXNKG,,,,,33.83580017,-117.9062958,anonymous,EN,,,Ava,,,"4,5,6,7,8,9",,,,,,,,,,,,,,,,,,,,,,,,,,,,,,,,,,,,,,,,,,,1,1,1,2,0,0,57.17,0,,,7,1,0,0,15.594,0,,,7,7,1,2,2,2,2,0,0,34.666,0,,,1,1,0,0,10.894,0,,,7,7,1,37,1,"It doesn't  really matter who uses the coffee machine often on what day. The most important part is when both person are using the machine on that Friday. Both got up and made coffee, so both person are to blame for the power outage.",none,3,2
02/11/2019 20:06,02/11/2019 20:14,0,98.23.38.34,100,484,1,02/11/2019 20:14,R_2CCkgL2Xde4cZF5,,,,,37.09950256,-84.11309814,anonymous,EN,,,Ava,,,"4,5,6,7,8,9",,,,,,,,,,,,,,,,,,,,,,,,,,,,,,,,,,,,,,,,,,,1,1,1,2,0,0,47.977,0,,,7,1,0,0,19.21,0,,,5,5,1,2,2,2,2,0,0,34.506,0,,,2,3,0,0,15.212,0,,,5,5,1,39,1,"I feel like neither of them are to blame entirely. In the first video, the other party watched the first make coffee each day so the watching party would be wise to assume the other person would make coffee on Friday. However, he/she still can't be entirely to blame for the power failure as they would still have the right to make coffee. In the second video, neither party was very well aware of what the other was doing so neither of them were to blame much at all. They both made their own choice without much knowledge about the choice the other would make.",,3,2
02/11/2019 20:18,02/11/2019 20:18,0,66.91.1.52,100,13,1,02/11/2019 20:18,R_1PSNlG761dNx4i6,,,,,19.70599365,-155.092804,anonymous,EN,emma,,,,,,,,,,,,,,,,,,,,,,,,,,,,,,,,,,,,,,,,,,,,,,,,,,,,,,,,,,,,,,,,,,,,,,,,,,,,,,,,,,,,,,,,,,,,,,,
02/11/2019 20:13,02/11/2019 20:22,0,73.198.109.124,100,532,1,02/11/2019 20:22,R_3061IBeGhaG03wp,,,,,40.63679504,-74.37270355,anonymous,EN,,,,,James,"4,5,6,7,8,9",,,,,,,,,,,,,,,,,,,,,,,,,,,,,,,,,,,,,,,,,,,1,1,1,2,0,0,52.788,0,,,7,1,0,0,13.025,0,,,1,1,1,2,2,2,2,0,0,35.348,0,,,1,1,0,0,14.251,0,,,1,1,1,36,1,"Neither party knew when the other party was going to make coffee. There was no set specific time either person decided to make coffee. It was just pure coincidence that when one person made coffee on Friday, the other person also made coffee at the same time. The odds of that are incredible.",,4,2
02/11/2019 20:17,02/11/2019 20:23,0,98.21.199.101,100,372,1,02/11/2019 20:23,R_cNl65s398POZrYl,,,,,40.97019958,-76.90989685,anonymous,EN,Emma,,,,,"4,5,6,7,8,9",1,1,1,2,0,0,43.802,0,,,5,3,0,0,12.1,0,,,3,6,1,2,2,2,2,0,0,36,0,,,4,4,0,0,19.26,0,,,6,4,1,,,,,,,,,,,,,,,,,,,,,,,,,,,,,,,,,,,,,,,,,,,23,1,I thought whoever used the microwave the most during the week was responsible on Friday for the power failure.,,2,2
02/11/2019 20:15,02/11/2019 20:24,0,174.193.42.95,100,516,1,02/11/2019 20:24,R_2uyUOt4glVf2AOI,,,,,35.31930542,-80.74559784,anonymous,EN,,,Ava,,,"4,5,6,7,8,9",,,,,,,,,,,,,,,,,,,,,,,,,,,,,,,,,,,,,,,,,,,1,1,1,2,1.142,51.372,55.501,2,1,7,,,4.433,18.867,20.763,3,1,7,,,1,2,2,2,2,1.386,76.09,78.38,14,1,5,,,1.674,20.89,23.136,3,1,7,,,1,37,2,"If you make coffee everyday, it's not your fault when you make coffee everyday. But when you needed make coffee and then just decide to have some randomly, that's on you. Really though, it's the companies fault for not just designating one coffee pot to be used for Fridays. ",,4,1
02/11/2019 20:18,02/11/2019 20:24,0,107.147.34.205,100,406,1,02/11/2019 20:24,R_31zt9mhAw9GwzMQ,,,,,40.57429504,-85.67410278,anonymous,EN,,Benjamin,,,,"4,5,6,7,8,9",,,,,,,,,,,,,,,,,,,,,,,,,,,,,,,,,,,,,,,,,,,2,1,2,1,0,0,36.454,0,4,5,,,0,0,190.726,0,4,6,,,1,2,2,1,1,28.613,29.989,35.676,2,3,5,,,0,0,12.142,0,3,5,,,2,36,2,thank you,thank you,3,1
02/11/2019 20:17,02/11/2019 20:26,0,72.75.234.161,100,520,1,02/11/2019 20:26,R_3dEvToib8b0JCK9,,,,,42.96850586,-78.74919891,anonymous,EN,,,,,James,"4,5,6,7,8,9",1,1,1,2,101.994,101.994,121.878,1,,,7,1,0,0,19.069,0,,,4,4,1,2,2,2,2,0,0,32.288,0,,,1,1,0,0,12.689,0,,,4,4,1,,,,,,,,,,,,,,,,,,,,,,,,,,,,,,,,,,,,,,,,,,,42,2,by seeing if the other person was expecting the other person to use the microwave,,1,2
02/11/2019 20:16,02/11/2019 20:28,0,196.247.50.110,100,725,1,02/11/2019 20:28,R_12mccHxD9eVubwX,,,,,33.7552948,-84.38860321,anonymous,EN,,,,Noah,,"4,5,6,7,8,9",1,1,1,2,0,0,55.464,0,,,4,4,0,0,18.203,0,,,7,7,1,2,2,2,2,0,0,34.979,0,,,7,4,0,0,19.789,0,,,7,7,1,,,,,,,,,,,,,,,,,,,,,,,,,,,,,,,,,,,,,,,,,,,27,1,made my judgment base on the information i saw and the video clip ,n/a,1,2
02/11/2019 20:21,02/11/2019 20:32,0,98.244.184.44,100,659,1,02/11/2019 20:32,R_1JWbjKNOnnxM1nk,,,,,31.60429382,-81.88710022,anonymous,EN,,Benjamin,,,,"4,5,6,7,8,9",1,1,1,2,0,0,44.266,0,1,7,,,0,0,11.064,0,7,7,,,1,2,2,2,2,0,0,34.466,0,4,4,,,0,0,18.219,0,7,7,,,1,,,,,,,,,,,,,,,,,,,,,,,,,,,,,,,,,,,,,,,,,,,55,1,"My thought is they both know in either scenario that power will be cut if more than one microwave is used on Friday. So each person that uses a microwave is responsible for knowing if other people will be. So anyone that uses a microwave on Friday's is ultimately responsible for any power cut that takes place. I in a sense disregarded the use m-f as far as responsibility for power cut, since all microwave users should know the policy and know if others are going to use one as well.",,2,1
02/11/2019 20:28,02/11/2019 20:37,0,99.13.250.13,100,566,1,02/11/2019 20:37,R_3PixyF01x3eSuBI,,,,,28.94549561,-80.89689636,anonymous,EN,,,Ava,,,"4,5,6,7,8,9",,,,,,,,,,,,,,,,,,,,,,,,,,,,,,,,,,,,,,,,,,,1,1,1,2,0,0,52.558,0,1,7,,,0,0,23.562,0,7,7,,,1,2,2,2,2,0,0,38.373,0,1,1,,,0,0,16.133,0,1,7,,,1,68,2,"in the second scenario, henry didn't know if james made coffee or not, but since henry never made coffee in scenario one, i assumed james wasn't a coffee drinker, therefore since he made coffee on friday, he caused the break in power",,3,1
02/11/2019 20:15,02/11/2019 20:38,0,74.196.102.74,100,1360,1,02/11/2019 20:38,R_78V9Sse3ZD1Hsul,,,,,35.98219299,-96.75260162,anonymous,EN,,Benjamin,,,,"4,5,6,7,8,9",,,,,,,,,,,,,,,,,,,,,,,,,,,,,,,,,,,,,,,,,,,1,1,1,2,49.38,49.38,49.799,1,1,7,,,0,0,14.377,0,4,4,,,1,2,2,2,2,0,0,32.702,0,2,6,,,0,0,17.82,0,4,4,,,1,44,2,I just followed along and went with my instincts.,,4,1
02/11/2019 20:27,02/11/2019 20:39,0,47.25.220.78,100,717,1,02/11/2019 20:39,R_6h7iMkvH25Np9PX,,,,,42.40730286,-124.4217987,anonymous,EN,Emma,,,,,"4,5,6,7,8,9",1,1,1,2,0,0,46.613,0,,,7,1,0,0,11.229,0,,,4,4,1,2,2,2,1,0,0,36.654,0,,,7,1,0,0,22.621,0,,,4,4,1,,,,,,,,,,,,,,,,,,,,,,,,,,,,,,,,,,,,,,,,,,,65,2,"I did not really have an opinion. Clearly, you wanted me to blame the guy who uses the microwave all the time as being the ""culprit""--or maybe it was the guy who knew the other guy would use it. I don't know.","No problems. Good survey, thanks!",2,2
02/11/2019 20:38,02/11/2019 20:44,0,96.66.19.209,100,387,1,02/11/2019 20:44,R_cvF31tH4bGPPPTH,,,,,42.43269348,-83.03959656,anonymous,EN,,,Ava,,,"4,5,6,7,8,9",1,1,1,2,9.183,13.056,48.33,2,,,6,3,0,0,17.002,0,,,6,6,1,2,2,2,2,9.355,25.621,47.653,3,,,4,4,0,0,18.551,0,,,6,6,1,,,,,,,,,,,,,,,,,,,,,,,,,,,,,,,,,,,,,,,,,,,33,1,Seems like it was both their faults in both scenarios cause they were both using a microwave.,,1,2
02/11/2019 20:18,02/11/2019 20:46,0,72.220.90.240,100,1646,1,02/11/2019 20:46,R_11XacnrQ2KWgD5C,,,,,32.79359436,-117.0689011,anonymous,EN,Emma,,,,,"4,5,6,7,8,9",1,1,1,2,6.629,9.288,44.398,2,,,7,2,4.081,5.149,13.184,2,,,7,7,1,2,2,2,2,38.132,38.681,39.806,2,,,7,2,3.408,3.408,21.117,1,,,7,7,1,,,,,,,,,,,,,,,,,,,,,,,,,,,,,,,,,,,,,,,,,,,33,1,"On the first video, I think both Eddie and Neil caused the power failure even though Eddie used the microwave more than Neil. Just because Eddie was using the microwave more than Neil the rest of the week, that doesn't give him a priority on using it so it's both their fault. On the second video, I think both Tom and Ben caused the power failure even though Tom used the microwave more than Ben. Just because Tom was using the microwave more than Ben the rest of the week, that doesn't give him a priority on using it so it's both their fault.",no issues encountered,2,2
02/11/2019 20:43,02/11/2019 20:50,0,163.185.148.245,100,423,1,02/11/2019 20:50,R_3NE4CyYQX8nLnWr,,,,,29.74389648,-95.60669708,anonymous,EN,,,,,James,"4,5,6,7,8,9",,,,,,,,,,,,,,,,,,,,,,,,,,,,,,,,,,,,,,,,,,,1,1,1,2,0,0,41.578,0,,,7,1,0,0,12.851,0,,,5,4,1,2,2,2,2,36.255,36.255,37.347,1,,,1,1,0,0,23.086,0,,,4,4,1,28,1,"It's truly no ones fault, as the company has a ludicrous policy. Although in the result of Dan and Bob, since Bob never makes coffee during the other days of the week, he is slightly at fault.",,4,2
02/11/2019 20:40,02/11/2019 20:54,0,69.254.188.247,100,863,1,02/11/2019 20:54,R_2EhL0bba096wjZq,,,,,30.41700745,-84.18499756,anonymous,EN,,,,,James,"4,5,6,7,8,9",1,1,1,2,0,0,45.86,0,,,6,2,0,0,14.314,0,,,6,6,1,2,2,2,2,0,0,35.652,0,,,4,3,0,0,19.41,0,,,6,6,1,,,,,,,,,,,,,,,,,,,,,,,,,,,,,,,,,,,,,,,,,,,24,2,"In both scenarios, I thought both parties were to blame for the power outage. In the first videos, the two workers didn't know each other so they had no frame of reference for how often the microwave was being used. The power outage was both of their faults because there was no way to anticipate if someone else was using a microwave. 
In the second video, the two workers knew each other and even though one used the microwave more regularly, the microwaves don't belong to one or the other and the pattern was not definitive. So, as in the first video, they are both to blame for causing the outage.",,2,2
02/11/2019 20:46,02/11/2019 20:56,0,68.104.228.249,100,568,1,02/11/2019 20:56,R_12nyC8aJlYl6ufj,,,,,33.33799744,-111.7434998,anonymous,EN,,Benjamin,,,,"4,5,6,7,8,9",,,,,,,,,,,,,,,,,,,,,,,,,,,,,,,,,,,,,,,,,,,1,1,1,2,0,0,53.505,0,,,7,1,0,0,19.063,0,,,6,2,1,2,2,2,2,0,0,39.144,0,,,4,4,0,0,21.027,0,,,6,6,1,53,1,In the first scenario neither subject knew the others habbits but in the second scenario the knew each other very well and Bob should have anticipated Dan making coffee.,,4,2
02/11/2019 20:52,02/11/2019 20:58,0,68.119.85.254,100,336,1,02/11/2019 20:58,R_1rCWVYKQIxgUZkC,,,,,32.54840088,-85.46820068,anonymous,EN,,,,,James,"4,5,6,7,8,9",1,1,1,2,0,0,44.171,0,2,7,,,0,0,11.08,0,5,5,,,1,2,2,2,2,0,0,34.166,0,4,4,,,0,0,15.386,0,3,3,,,1,,,,,,,,,,,,,,,,,,,,,,,,,,,,,,,,,,,,,,,,,,,23,1,"The first group of people were aware of each other, so they held more blame than the second group, who had no idea.",,1,1
02/11/2019 20:53,02/11/2019 21:14,0,24.1.169.71,100,1224,1,02/11/2019 21:14,R_27lfd1jScg2ohBS,,,,,41.68370056,-88.34989929,anonymous,EN,,Benjamin,,,,"4,5,6,7,8,9",1,1,1,2,0,0,75.167,0,1,7,,,0,0,33.518,0,1,7,,,1,2,2,2,2,0,0,37.214,0,4,4,,,0,0,15.663,0,6,6,,,1,,,,,,,,,,,,,,,,,,,,,,,,,,,,,,,,,,,,,,,,,,,51,2,"I made my judgement depending on whether the two co-workers know what each other was doing from Monday to Thursday. If someone A frequently used the microwave and was known to the other co-worker, A was not to be blamed for causing the explosion on Friday if A used it on Friday. But if the two co-workers did not know what each other was doing from Monday to Thursday, they should have avoided using the microwave on Friday to eliminate any chance of explosion. If not, they both were to be blamed.",none,1,1
02/11/2019 20:55,02/11/2019 21:15,0,24.93.29.236,100,1232,1,02/11/2019 21:15,R_uaK7x8WWCCkVuMh,,,,,43.06219482,-77.22180176,anonymous,EN,,,Ava,,,"4,5,6,7,8,9",1,1,1,2,0,0,54.1,0,,,7,1,0,0,11.913,0,,,7,7,1,1,2,2,2,0,0,34.621,0,,,1,1,0,0,15.33,0,,,7,7,1,,,,,,,,,,,,,,,,,,,,,,,,,,,,,,,,,,,,,,,,,,,25,1,It is each persons responsibility despite knowing one another to plan for the power outage on fridays.,,1,2
02/11/2019 21:20,02/11/2019 21:40,0,97.71.157.138,100,1185,1,02/11/2019 21:40,R_2f371b9yBx9LI3t,,,,,28.19839478,-81.48699951,anonymous,EN,,,,Noah,,"4,5,6,7,8,9",,,,,,,,,,,,,,,,,,,,,,,,,,,,,,,,,,,,,,,,,,,1,1,1,2,0,0,50.802,0,1,7,,,0,0,16.689,0,5,5,,,1,2,2,2,2,0,0,51.759,0,1,1,,,0,0,17.966,0,5,5,,,1,48,1,Just because in the second scenario the coworkers were more aware of each other's behavior didn't mean the fault changed in my opinion so I judged them the same.,No issues it all worked fine and I have no suggestions as the study seems fine as is.,4,1
02/11/2019 22:35,02/11/2019 22:59,0,98.214.91.188,100,1401,1,02/11/2019 22:59,R_6QLs4Iw3F1JSz4t,,,,,39.59919739,-86.12999725,anonymous,EN,,,,Noah,,"4,5,6,7,8,9",1,1,1,2,0,0,36.892,0,1,7,,,0,0,14.786,0,1,7,,,1,2,2,2,2,0,0,38.029,0,4,4,,,0,0,15.433,0,4,5,,,1,,,,,,,,,,,,,,,,,,,,,,,,,,,,,,,,,,,,,,,,,,,39,2,"In the first scenario because the two didn't know each other's habits, neither expected or knew if the other would use the microwave. However, since one man didn't use the microwave all week up to Friday, I do think it's somewhat his fault he caused the failure, though his ignorance of other's habits absolved his blame somewhat. In the second scenario it was ridiculous that both men used the microwave on Friday because one knew the other always used the microwave. It was totally, I want to say, Ben's fault.",,2,1
02/11/2019 23:20,02/11/2019 23:27,0,162.195.42.163,100,447,1,02/11/2019 23:27,R_3gXSC1t9HwFmKTp,,,,,44.49139404,-87.92669678,anonymous,EN,,Benjamin,,,,"4,5,6,7,8,9",1,1,1,2,0,0,43.179,0,1,7,,,0,0,10.38,0,4,6,,,1,2,2,2,2,0,0,36.388,0,1,1,,,0,0,17.482,0,4,4,,,1,,,,,,,,,,,,,,,,,,,,,,,,,,,,,,,,,,,,,,,,,,,38,1,"In the first one, no one was at fault because they didn't know each other. In the second, Ben knew that Tom used the microwave everyday so he was at fault for using it in my opinion.",,2,1
02/11/2019 23:58,03/11/2019 00:08,0,173.22.23.45,100,612,1,03/11/2019 00:08,R_2aKSHr2Fxalz5Zk,,,,,31.57910156,-84.21379852,anonymous,EN,,Benjamin,,,,"4,5,6,7,8,9",,,,,,,,,,,,,,,,,,,,,,,,,,,,,,,,,,,,,,,,,,,1,1,1,2,0,0,50.013,0,,,6,1,0,0,29.199,0,,,5,1,1,2,2,2,2,0,0,42.407,0,,,1,1,0,0,27.269,0,,,7,7,1,25,1,"In the 1st video, the man that didn't make coffee until Friday knew that his co-worker always made the coffee. He should have known to NOT make the coffee because his co-worker always made it. I thought the fault was more his. In the 2nd video, I thought the fault lay with both employees. One or both of them should have made sure to ask the other who would make the coffee that day.",,3,2
03/11/2019 01:32,03/11/2019 01:42,0,73.219.171.53,100,595,1,03/11/2019 01:42,R_1IJWSrqSzeMuRCH,,,,,42.67640686,-71.31860352,anonymous,EN,,,Ava,,,"4,5,6,7,8,9",1,1,1,2,0,0,45.434,0,7,1,,,0,0,10.501,0,5,3,,,1,2,2,2,2,0,0,36.77,0,4,4,,,0,0,15.852,0,4,4,,,1,,,,,,,,,,,,,,,,,,,,,,,,,,,,,,,,,,,,,,,,,,,60,2,"Well with the separate offices they would never know the habits of the other.  But the two that shared the office, they know each others habits and should know that tom was going to use the microwave.",No Problems,2,1
04/11/2019 20:23,04/11/2019 20:25,0,71.71.214.155,100,109,1,04/11/2019 20:25,R_2Wu9FGBrfnQvRwV,,,,,35.22270203,-80.79380035,anonymous,EN,emma,,,,,,,,,,,,,,,,,,,,,,,,,,,,,,,,,,,,,,,,,,,,,,,,,,,,,,,,,,,,,,,,,,,,,,,,,,,,,,,,,,,,,,,,,,,,,,,
04/11/2019 20:24,04/11/2019 20:31,0,174.30.45.127,100,416,1,04/11/2019 20:31,R_sRywZTwILvoBKyR,,,,,38.24310303,-93.38189697,anonymous,EN,,,,,James,"4,5,6,7,8,9",1,1,1,2,0,0,49.531,0,,,7,1,0,0,11.129,0,,,4,4,1,2,2,2,2,34.745,34.745,35.123,1,,,4,4,0,0,19.136,0,,,4,4,1,,,,,,,,,,,,,,,,,,,,,,,,,,,,,,,,,,,,,,,,,,,29,1,I don't think that any one person was at fault for the respective power failures. ,,1,2
04/11/2019 20:24,04/11/2019 20:31,0,67.45.96.105,100,453,1,04/11/2019 20:31,R_1ZADrIAKd4QEIgh,,,,,37.75100708,-97.8219986,anonymous,EN,,,,,James,"4,5,6,7,8,9",,,,,,,,,,,,,,,,,,,,,,,,,,,,,,,,,,,,,,,,,,,1,1,1,2,68.504,68.767,69.191,2,1,7,,,0,0,29.885,0,7,7,,,1,2,2,2,2,0,0,39.41,0,1,1,,,0,0,31.048,0,7,7,,,1,25,2,"The first video they knew where the person was, so it was a guess that the same person would for sure make coffee on Friday. 
The second video was harder to guess. They don't work in the same room, nor know each other. Therefore, they wouldn't know the others habits.",,3,1
04/11/2019 20:25,04/11/2019 20:32,0,75.191.15.75,100,414,1,04/11/2019 20:32,R_1i2v2c4yk5nL0Kq,,,,,36.29600525,-76.24349976,anonymous,EN,,,,Noah,,"4,5,6,7,8,9",1,1,1,1,0,0,34.19,0,1,7,,,0,0,10.118,0,4,4,,,1,2,2,2,1,0,0,34.87,0,2,6,,,0,0,11.341,0,4,4,,,1,,,,,,,,,,,,,,,,,,,,,,,,,,,,,,,,,,,,,,,,,,,22,1,I made my judgement based on who used the microwave more than the other person,,2,1
04/11/2019 20:24,04/11/2019 20:32,0,23.81.95.116,100,501,1,04/11/2019 20:32,R_1QG79RJvKrovVmc,,,,,33.27270508,-111.8277969,anonymous,EN,,,,,James,"4,5,6,7,8,9",,,,,,,,,,,,,,,,,,,,,,,,,,,,,,,,,,,,,,,,,,,1,1,1,1,0,0,85.511,0,,,6,6,0,0,24.708,0,,,6,6,1,1,1,1,1,0,0,71.433,0,,,6,6,25.722,25.722,26.795,1,,,6,6,1,54,1,dan coffe make frequintly,good,4,2
04/11/2019 20:24,04/11/2019 20:32,0,216.213.71.37,100,520,1,04/11/2019 20:32,R_1Hkl7ogNGuclDJe,,,,,44.00360107,-103.358902,anonymous,EN,,,,Noah,,"4,5,6,7,8,9",1,1,1,2,33.369,33.369,42.902,1,2,6,,,9.267,9.267,10.456,1,2,7,,,1,2,2,2,2,33.466,33.466,54.661,1,2,6,,,14.379,14.379,17.192,1,3,5,,,1,,,,,,,,,,,,,,,,,,,,,,,,,,,,,,,,,,,,,,,,,,,27,2,"In the first video, the two people didn't know each other. So they didn't know who or when they were going to use the microwave. So it's not either of their fault entirely. In the 2nd video, they know each others routines. So, the person should know that the 1st person uses the microwave every day, the 2nd person shouldn't use it.",,2,1
04/11/2019 20:24,04/11/2019 20:33,0,73.181.132.151,100,581,1,04/11/2019 20:33,R_UGdPImYSgAn7FND,,,,,47.94250488,-122.2138977,anonymous,EN,,,,,James,"4,5,6,7,8,9",,,,,,,,,,,,,,,,,,,,,,,,,,,,,,,,,,,,,,,,,,,1,1,1,2,0,0,41.408,0,,,7,1,0,0,14.174,0,,,5,3,1,2,2,2,2,0,0,34.6,0,,,4,4,3.306,3.945,13.186,2,,,4,4,1,25,1,"When the two people shared an office they could observe that one person drinks coffee every day and the other doesn't, it is then the person who doesn't drink coffee every day to not cause the power failure. In the other situation the two coworkers cannot observe the other's habits so it is not explicitly ones fault",N/A,3,2
04/11/2019 20:24,04/11/2019 20:35,0,73.98.19.110,100,675,1,04/11/2019 20:35,R_5tiMnWEHB9sbubT,,,,,35.23390198,-106.6200027,anonymous,EN,Emma,,,,,"4,5,6,7,8,9",1,1,1,2,0,0,43.261,0,1,7,,,0,0,16.399,0,2,6,,,1,2,2,2,2,0,0,35.771,0,4,4,,,0,0,16.844,0,6,6,,,1,,,,,,,,,,,,,,,,,,,,,,,,,,,,,,,,,,,,,,,,,,,31,1,"On the first video, since both people worked together and knew each other well, it should have been known that one of the two frequently uses the microwave each day. So, when they switched offices, it should have been well known that the microwave was going to be used that day. So, the person that does not frequently use the microwave is to blame because he knew that the other microwave was going to be used as well that day. In the other scenario, since the two people worked separately and didn't know each others habits, neither could really be blamed over the other. So, it was equally each others faults. ",,1,1
04/11/2019 20:32,04/11/2019 20:38,0,173.88.191.245,100,397,1,04/11/2019 20:38,R_x3DNbPcXa4x5zCV,,,,,41.19099426,-80.9701004,anonymous,EN,Emma,,,,,"4,5,6,7,8,9",,,,,,,,,,,,,,,,,,,,,,,,,,,,,,,,,,,,,,,,,,,1,1,1,1,48.482,49.502,50.054,2,1,5,,,4.679,16.321,16.899,2,5,6,,,1,2,2,2,1,37.246,37.246,37.918,1,4,4,,,13.196,13.196,13.909,1,4,1,,,1,37,2,the first two men were closer so they should have know and agreed who would make coffee on friday. the other men never talked so they were less at fault,,3,1
04/11/2019 20:29,04/11/2019 20:40,0,70.114.131.174,100,677,1,04/11/2019 20:40,R_2aQTnQdXtRyIDXq,,,,,30.51539612,-97.66889954,anonymous,EN,Emma,,,,,"4,5,6,7,8,9",,,,,,,,,,,,,,,,,,,,,,,,,,,,,,,,,,,,,,,,,,,1,1,1,2,0,0,45.913,0,,,7,1,0,0,15.44,0,,,6,1,1,2,2,2,2,72.864,72.864,77.169,1,,,1,1,16.78,16.78,17.21,1,,,1,1,1,41,1,"In the situation where neither person was aware of the other's activities during the week, there was no way for them to know that the other person would make coffe on friday in addition to themselves.

In the second scenario, Bob was completely aware that Dan made coffee every day, and Dan never saw Bob make coffee.  Therefore, it would be logical to assume that Dan would not expect Bob to make coffee and he would continue to do his normal routine.  Bob, on the other hand, should fully expect dan to make coffee and should be aware of this fact before making it himself.","None, thank you.",4,2
04/11/2019 20:34,04/11/2019 20:41,0,108.193.193.210,100,457,1,04/11/2019 20:41,R_3s6qACsWJTQlBrt,,,,,37.55439758,-97.25859833,anonymous,EN,,,,,James,"4,5,6,7,8,9",1,1,1,2,207.517,207.517,208.376,1,,,4,4,0,0,48.902,0,,,4,4,1,1,2,1,1,0,0,32.889,0,,,4,4,0,0,12.329,0,,,4,4,1,,,,,,,,,,,,,,,,,,,,,,,,,,,,,,,,,,,,,,,,,,,29,2,I just watched and chose based on what i saw,,2,2
04/11/2019 20:33,04/11/2019 20:42,0,72.73.27.195,100,524,1,04/11/2019 20:42,R_3HXEqMtUaPtIYd0,,,,,38.27099609,-77.54949951,anonymous,EN,,Benjamin,,,,"4,5,6,7,8,9",,,,,,,,,,,,,,,,,,,,,,,,,,,,,,,,,,,,,,,,,,,1,1,1,2,60.807,61.223,61.605,2,4,2,,,9.776,10.597,11.586,2,6,4,,,1,2,2,2,2,36.138,36.138,36.911,1,1,4,,,12.112,12.112,13.488,1,7,3,,,1,40,1,I just tried to guess the best I could with the information that was given to me.,,4,1
04/11/2019 20:34,04/11/2019 20:43,0,71.233.121.19,100,532,1,04/11/2019 20:43,R_2YEtvjVqU2XOUpz,,,,,41.61270142,-70.91670227,anonymous,EN,,,,,James,"4,5,6,7,8,9",,,,,,,,,,,,,,,,,,,,,,,,,,,,,,,,,,,,,,,,,,,1,1,1,2,0,0,47.324,0,1,7,,,0,0,17.941,0,7,7,,,1,2,2,2,2,34.896,34.896,36.74,1,1,1,,,0,0,13.296,0,7,7,,,1,41,1,"Regardless of how frequent the coffee makers were being used during the week, it had no bearing on who's fault it was on Friday when only one coffee maker was allowed to be running at one time. Both people were responsible for the power outage.",,3,1
04/11/2019 20:31,04/11/2019 20:43,0,75.151.230.113,100,720,1,04/11/2019 20:43,R_2P4F803GrgU9boC,,,,,40.26919556,-80.16110229,anonymous,EN,,,,Noah,,"4,5,6,7,8,9",,,,,,,,,,,,,,,,,,,,,,,,,,,,,,,,,,,,,,,,,,,1,1,1,2,0,0,51.074,0,1,7,,,0,0,19.007,0,1,7,,,1,2,2,2,2,0,0,36.825,0,1,1,,,0,0,19.725,0,1,7,,,1,45,2,"With Dan and Bob, Bob would know that Dan makes the coffee everyday, so he would just need to go to Dan's office to get a cup of coffee.  With James and Henry, James makes coffee everyday and Henry never drinks coffee, on Friday he would be aware of the companies rule so he should check to see if anyone else is making coffee before he does",,4,1
04/11/2019 20:34,04/11/2019 20:43,0,76.211.180.20,100,571,1,04/11/2019 20:43,R_1i5r80t3j2iMpbp,,,,,29.57380676,-98.22920227,anonymous,EN,,,,Noah,,"4,5,6,7,8,9",1,1,1,2,0,0,69.741,0,,,7,1,0,0,10.996,0,,,6,6,1,2,2,2,2,0,0,33.957,0,,,4,4,0,0,15.401,0,,,5,5,1,,,,,,,,,,,,,,,,,,,,,,,,,,,,,,,,,,,,,,,,,,,41,2,"In both videos I think each are responsible for the power outage because each of them knew there was a chance another would use the microwave. Although the second group did not know the other, it is a known company policy to have a Green Energy day on Friday. They chose to use the microwave rather than just not using it on a Friday.",none,1,2
04/11/2019 20:35,04/11/2019 20:44,0,173.23.42.244,100,541,1,04/11/2019 20:44,R_1gCTI8vxD7TuaCV,,,,,42.09790039,-89.08380127,anonymous,EN,,,,Noah,,"4,5,6,7,8,9",,,,,,,,,,,,,,,,,,,,,,,,,,,,,,,,,,,,,,,,,,,1,1,1,2,0,0,52.669,0,,,7,1,0,0,14.788,0,,,7,7,1,2,2,2,2,0,0,34.334,0,,,4,4,0,0,14.786,0,,,7,7,1,39,2,If both people made coffee it equally caused the power failure. The people that mostly work together could have had a discussion first.,No comments at the current time.,3,2
