StartDate,EndDate,Status,IPAddress,Progress,Duration (in seconds),Finished,RecordedDate,ResponseId,RecipientLastName,RecipientFirstName,RecipientEmail,ExternalReference,LocationLatitude,LocationLongitude,DistributionChannel,UserLanguage,Q379,Q380,Q381,Q382,Q383,Consent,C_One_Office,C_One_Know,C_One_Day,C_One_Struc,Q333_First Click,Q333_Last Click,Q333_Page Submit,Q333_Click Count,Micro1_One_Exp_A1_1,Micro1_One_Exp_A2_1,Micro2_One_Exp_A2_1,Micro2_One_Exp_A1_1,Q386_First Click,Q386_Last Click,Q386_Page Submit,Q386_Click Count,Micro1_One_Cause_A1_1,Micro1_One_Cause_A2_1,Micro_One_Cause_A2_1,Micro_One_Cause_A1_1,C_One_Freq,C_Sep_Office,C_Sep_Know,C_Sep_Day,C_Sep_Struc,Q397_First Click,Q397_Last Click,Q397_Page Submit,Q397_Click Count,Micro1_Sep_Exp_A1_1,Micro1_Sep_Exp_A2_1,Micro2_Sep_Exp_A2_1,Micro2_Sep_Exp_A1_1,Q404_First Click,Q404_Last Click,Q404_Page Submit,Q404_Click Count,Micro1_Sep_Cause_A1_1,Micro1_Sep_Cause_A2_1,Micro2_Sep_Cause_A2_1,Micro2_Sep_Cause_A1_1,C_Sep_Freq,C_One_Office,C_One_Know,C_One_Day,C_One_Struc,Q415_First Click,Q415_Last Click,Q415_Page Submit,Q415_Click Count,Coffee1_One_Exp_A1_1,Coffee1_One_Exp_A2_1,Coffee2_One_Exp_A2_1,Coffee2_One_Exp_A1_1,Q418_First Click,Q418_Last Click,Q418_Page Submit,Q418_Click Count,Coffee1_One_Cause_A1_1,Coffee1_One_Cause_A2_1,Coffee2_One_Cause_A2_1,Coffee2_One_Cause_A1_1,C_One_Freq,C_Sep_Office,C_Sep_Know,C_Sep_Day,C_Sep_Struc,Q428_First Click,Q428_Last Click,Q428_Page Submit,Q428_Click Count,Coffee1_Sep_Exp_A1_1,Coffee1_Sep_Exp_A2_1,Coffee2_Sep_Exp_A2_1,Coffee2_Sep_Exp_A1_1,Q433_First Click,Q433_Last Click,Q433_Page Submit,Q433_Click Count,Coffee1_Sep_Cause_A1_1,Coffee1_Sep_Cause_A2_1,Coffee2_Sep_Cause_A2_1,Coffee2_Sep_Cause_A1_1,C_Sep_Freq,Age,Gender,Explanation,Suggestions,Condition,Order
Start Date,End Date,Response Type,IP Address,Progress,Duration (in seconds),Finished,Recorded Date,Response ID,Recipient Last Name,Recipient First Name,Recipient Email,External Data Reference,Location Latitude,Location Longitude,Distribution Channel,User Language,"Are you a bot?

 

Liam says to Emma: ""It's a beautiful day, isn't it?""
 

Who is Liam talking to? (case sensitive)","Are you a bot?

 

Mia says to Benjamin: ""It's a beautiful day, isn't it?""
 

Who is Mia talking to? (case sensitive)","Are you a bot?

 

William says to Ava: ""It's a beautiful day, isn't it?""
 

Who is William talking to? (case sensitive)","Are you a bot?

 

Amelia says to Noah: ""It's a beautiful day, isn't it?""
 

Who is Amelia talking to? (case sensitive)","Are you a bot?

 

Evelyn says to James: ""It's a beautiful day, isn't it?""
 

Who is Evelyn talking to? (case sensitive)","Causal Judgements in everyday contexts

This study has been approved by the Ethics Chair for the ""UCL Psychology and Language Science"" Research Department. Project ID No: CPB/2014/006 .

 
Participant's Statement","From Monday to Thursday, Tom and Ben work ...","Because of their office situation, Tom and Ben ...","Because of their office situation, Tom and Ben ...",The use of how many microwaves does it take to produce a power failure on Friday?,Timing - First Click,Timing - Last Click,Timing - Page Submit,Timing - Click Count,(1)  Tom    expects  Ben     to use the microwave on Friday.,(2) Ben    expects  Tom     to use the microwave on Friday.,(1) Ben    expects  Tom     to use the microwave on Friday.,(2)  Tom    expects  Ben     to use the microwave on Friday.,Timing - First Click,Timing - Last Click,Timing - Page Submit,Timing - Click Count,(1)  Tom    has caused the power failure.,(2) Ben   has caused the power failure.,(1) Ben   has caused the power failure.,(2)  Tom    has caused the power failure.,Who used a microwave frequently (rather than infrequently) this week?,"From Monday to Thursday, Eddie and Neil work ...","Because of their office situation, Eddie and Neil ...","Because of their office situation, Eddie and Neil ...",The use of how many microwaves does it take to produce a power failure on Friday?,Timing - First Click,Timing - Last Click,Timing - Page Submit,Timing - Click Count,(1)  Eddie      expects  Neil      to use the microwave on Friday.,(2)  Neil    expects  Eddie    to use the microwave on Friday.,(1)  Neil    expects  Eddie    to use the microwave on Friday.,(2)  Eddie      expects  Neil      to use the microwave on Friday.,Timing - First Click,Timing - Last Click,Timing - Page Submit,Timing - Click Count,(1)  Eddie  has caused the power failure.,(2) Neil   has caused the power failure.,(1) Neil   has caused the power failure.,(2)  Eddie  has caused the power failure.,Who used a microwave frequently (rather than infrequently) this week?,"From Monday to Thursday, Dan and Bob work ...","Because of their office situation, Dan and Bob ...","Because of their office situation, Dan and Bob ...",The use of how many coffee machines does it take to produce a power failure on Friday?,Timing - First Click,Timing - Last Click,Timing - Page Submit,Timing - Click Count,(1)  Dan    expects  Bob     to make coffee on Friday.,(2) Bob    expects  Dan    to make coffee on Friday.,(1) Bob    expects  Dan    to make coffee on Friday.,(2)  Dan    expects  Bob     to make coffee on Friday.,Timing - First Click,Timing - Last Click,Timing - Page Submit,Timing - Click Count,(1)  Dan    has caused the power failure.,(2) Bob    has caused the power failure.,(1) Bob    has caused the power failure.,(2)  Dan    has caused the power failure.,Who used a coffee machine frequently (rather than infrequently) this week?,"From Monday to Thursday, Henry and James work ...","Because of their office situation, Henry and James ...","Because of their office situation, Henry and James ...",The use of how many coffee machines does it take to produce a power failure on Friday?,Timing - First Click,Timing - Last Click,Timing - Page Submit,Timing - Click Count,(1)  James      expects  Henry    to make coffee on Friday.,(2)  Henry   expects  James    to make coffee on Friday.,(1)  Henry   expects  James    to make coffee on Friday.,(2)  James      expects  Henry    to make coffee on Friday.,Timing - First Click,Timing - Last Click,Timing - Page Submit,Timing - Click Count,(1)  James  has caused the power failure.,(2) Henry    has caused the power failure.,(1)  James  has caused the power failure.,(2) Henry    has caused the power failure.,Who used a coffee machine frequently (rather than infrequently) this week?,"What is your age? (U.S. Census, 9 Categories)",What is your gender?,Please provide a (very brief!) explanation of how you made your judgements with regards to the two videos.,"Thank you for your participation.
If you experienced any issues with the survey/the videos
AND/OR
you have any suggestions for improvements or thoughts you would like to share, please comment below.
Then click on the arrow to receive your payment code.",Condition,Order
"{""ImportId"":""startDate"",""timeZone"":""Europe/London""}","{""ImportId"":""endDate"",""timeZone"":""Europe/London""}","{""ImportId"":""status""}","{""ImportId"":""ipAddress""}","{""ImportId"":""progress""}","{""ImportId"":""duration""}","{""ImportId"":""finished""}","{""ImportId"":""recordedDate"",""timeZone"":""Europe/London""}","{""ImportId"":""_recordId""}","{""ImportId"":""recipientLastName""}","{""ImportId"":""recipientFirstName""}","{""ImportId"":""recipientEmail""}","{""ImportId"":""externalDataReference""}","{""ImportId"":""locationLatitude""}","{""ImportId"":""locationLongitude""}","{""ImportId"":""distributionChannel""}","{""ImportId"":""userLanguage""}","{""ImportId"":""QID379_TEXT""}","{""ImportId"":""QID380_TEXT""}","{""ImportId"":""QID381_TEXT""}","{""ImportId"":""QID382_TEXT""}","{""ImportId"":""QID383_TEXT""}","{""ImportId"":""QID84""}","{""ImportId"":""QID366""}","{""ImportId"":""QID367""}","{""ImportId"":""QID372""}","{""ImportId"":""QID368""}","{""ImportId"":""QID333_FIRST_CLICK""}","{""ImportId"":""QID333_LAST_CLICK""}","{""ImportId"":""QID333_PAGE_SUBMIT""}","{""ImportId"":""QID333_CLICK_COUNT""}","{""ImportId"":""QID334_1""}","{""ImportId"":""QID336_1""}","{""ImportId"":""QID440_1""}","{""ImportId"":""QID439_1""}","{""ImportId"":""QID386_FIRST_CLICK""}","{""ImportId"":""QID386_LAST_CLICK""}","{""ImportId"":""QID386_PAGE_SUBMIT""}","{""ImportId"":""QID386_CLICK_COUNT""}","{""ImportId"":""QID389_1""}","{""ImportId"":""QID390_1""}","{""ImportId"":""QID443_1""}","{""ImportId"":""QID442_1""}","{""ImportId"":""QID205""}","{""ImportId"":""QID392""}","{""ImportId"":""QID393""}","{""ImportId"":""QID394""}","{""ImportId"":""QID395""}","{""ImportId"":""QID397_FIRST_CLICK""}","{""ImportId"":""QID397_LAST_CLICK""}","{""ImportId"":""QID397_PAGE_SUBMIT""}","{""ImportId"":""QID397_CLICK_COUNT""}","{""ImportId"":""QID284_1""}","{""ImportId"":""QID294_1""}","{""ImportId"":""QID455_1""}","{""ImportId"":""QID454_1""}","{""ImportId"":""QID404_FIRST_CLICK""}","{""ImportId"":""QID404_LAST_CLICK""}","{""ImportId"":""QID404_PAGE_SUBMIT""}","{""ImportId"":""QID404_CLICK_COUNT""}","{""ImportId"":""QID435_1""}","{""ImportId"":""QID436_1""}","{""ImportId"":""QID452_1""}","{""ImportId"":""QID451_1""}","{""ImportId"":""QID377""}","{""ImportId"":""QID410""}","{""ImportId"":""QID411""}","{""ImportId"":""QID412""}","{""ImportId"":""QID413""}","{""ImportId"":""QID415_FIRST_CLICK""}","{""ImportId"":""QID415_LAST_CLICK""}","{""ImportId"":""QID415_PAGE_SUBMIT""}","{""ImportId"":""QID415_CLICK_COUNT""}","{""ImportId"":""QID344_1""}","{""ImportId"":""QID346_1""}","{""ImportId"":""QID458_1""}","{""ImportId"":""QID457_1""}","{""ImportId"":""QID418_FIRST_CLICK""}","{""ImportId"":""QID418_LAST_CLICK""}","{""ImportId"":""QID418_PAGE_SUBMIT""}","{""ImportId"":""QID418_CLICK_COUNT""}","{""ImportId"":""QID420_1""}","{""ImportId"":""QID421_1""}","{""ImportId"":""QID446_1""}","{""ImportId"":""QID445_1""}","{""ImportId"":""QID233""}","{""ImportId"":""QID423""}","{""ImportId"":""QID424""}","{""ImportId"":""QID425""}","{""ImportId"":""QID426""}","{""ImportId"":""QID428_FIRST_CLICK""}","{""ImportId"":""QID428_LAST_CLICK""}","{""ImportId"":""QID428_PAGE_SUBMIT""}","{""ImportId"":""QID428_CLICK_COUNT""}","{""ImportId"":""QID319_1""}","{""ImportId"":""QID321_1""}","{""ImportId"":""QID461_1""}","{""ImportId"":""QID460_1""}","{""ImportId"":""QID433_FIRST_CLICK""}","{""ImportId"":""QID433_LAST_CLICK""}","{""ImportId"":""QID433_PAGE_SUBMIT""}","{""ImportId"":""QID433_CLICK_COUNT""}","{""ImportId"":""QID406_1""}","{""ImportId"":""QID407_1""}","{""ImportId"":""QID448_1""}","{""ImportId"":""QID449_1""}","{""ImportId"":""QID437""}","{""ImportId"":""QID32_TEXT""}","{""ImportId"":""QID33""}","{""ImportId"":""QID185_TEXT""}","{""ImportId"":""QID36_TEXT""}","{""ImportId"":""Condition""}","{""ImportId"":""Order""}"
02/11/2019 19:16,02/11/2019 19:18,0,23.81.55.202,100,149,1,02/11/2019 19:18,R_cA4v6nYqP5VGvex,,,,,33.27270508,-111.8277969,anonymous,EN,,,dont know,,,,,,,,,,,,,,,,,,,,,,,,,,,,,,,,,,,,,,,,,,,,,,,,,,,,,,,,,,,,,,,,,,,,,,,,,,,,,,,,,,,,,,,,,,,,,
02/11/2019 19:14,02/11/2019 19:20,0,66.66.146.234,100,315,1,02/11/2019 19:20,R_3PBqOu0fBT34yn8,,,,,43.22070313,-77.59919739,anonymous,EN,Emma,,,,,"4,5,6,7,8,9",,,,,,,,,,,,,,,,,,,,,,,,,,,,,,,,,,,,,,,,,,,1,1,1,2,40.105,40.105,40.958,1,,,6,2,14.813,14.813,15.54,1,,,6,3,1,2,2,2,1,35.774,35.774,36.525,1,,,3,3,19.041,19.041,20.053,1,,,5,5,1,42,1,Based somewhat on what was doneduring the weeks and mainly on what the others expecgted,,3,2
02/11/2019 19:14,02/11/2019 19:20,0,71.115.145.137,100,382,1,02/11/2019 19:20,R_9mMbQV3Z4AUCmA1,,,,,43.15710449,-76.32800293,anonymous,EN,,,,Noah,,"4,5,6,7,8,9",,,,,,,,,,,,,,,,,,,,,,,,,,,,,,,,,,,,,,,,,,,1,1,1,2,0,0,47.238,0,,,6,4,14.074,14.074,14.379,1,,,5,4,1,2,2,2,2,0,0,35.566,0,,,5,3,0,0,14.476,0,,,5,5,2,29,1,The one that made the coffee most frequently likely would continue that trend and the other person should know for the most part.,,4,2
02/11/2019 19:14,02/11/2019 19:21,0,99.68.56.159,100,412,1,02/11/2019 19:21,R_2QxH1ClZbgW66uu,,,,,37.82229614,-83.78530121,anonymous,EN,,,,Noah,,"4,5,6,7,8,9",1,1,1,1,0,0,47.786,0,1,7,,,0,0,11.613,0,6,7,,,1,2,2,2,1,0,0,35.797,0,1,1,,,0,0,19.49,0,7,7,,,1,,,,,,,,,,,,,,,,,,,,,,,,,,,,,,,,,,,,,,,,,,,24,2,If they knew what the other persons habits were and if they expected the other to use the microwave. ,None,2,1
02/11/2019 19:14,02/11/2019 19:22,0,99.155.177.238,100,462,1,02/11/2019 19:22,R_2r7NmnwA9u6GkXT,,,,,39.27330017,-94.56939697,anonymous,EN,,,,,James,"4,5,6,7,8,9",1,1,1,2,0,0,49.692,0,1,7,,,0,0,12.435,0,2,6,,,1,1,2,2,2,0,0,34.32,0,2,5,,,0,0,21.771,0,3,5,,,1,,,,,,,,,,,,,,,,,,,,,,,,,,,,,,,,,,,,,,,,,,,24,1,"If they are in different offices during the week, neither of them can know the other one will use the microwave and therefore they share similar blame. 

If they both use the same office M-Th, then they know each other's use of the microwave. Therefore, they should know that Tom would use the microwave every day.",,2,1
02/11/2019 19:16,02/11/2019 19:22,0,172.11.220.144,100,365,1,02/11/2019 19:22,R_1LhZqsPPDYNGOgV,,,,,39.64379883,-84.17430115,anonymous,EN,Emma,,,,,"4,5,6,7,8,9",1,1,2,2,0,0,32.401,0,1,7,,,0,0,9.677,0,4,4,,,1,2,2,2,2,0,0,32.173,0,4,4,,,0,0,9.216,0,4,4,,,1,,,,,,,,,,,,,,,,,,,,,,,,,,,,,,,,,,,,,,,,,,,37,1,I decided based on what I saw.,,1,1
02/11/2019 19:15,02/11/2019 19:22,0,76.98.150.171,100,452,1,02/11/2019 19:22,R_1dvktmMBe38aCuQ,,,,,40.08999634,-75.03630066,anonymous,EN,,,,,James,"4,5,6,7,8,9",1,1,1,2,10.946,10.946,43.935,1,2,7,,,0,0,12.824,0,4,4,,,1,2,2,2,2,0,0,32.402,0,4,4,,,0,0,16.816,0,4,4,,,1,,,,,,,,,,,,,,,,,,,,,,,,,,,,,,,,,,,,,,,,,,,30,2,"For the first set, the two coworkers could've previously commented upon their food plans for Friday in order to avoid a power outage. I would say they are equally to blame if they did not communicate this to each other since they already speak frequently. For the second set, neither coworker is to blame because they have no line of communication during any day and would never know if the other would be using the microwave or to set up a schedule.",No comment. Thank you.,1,1
02/11/2019 19:14,02/11/2019 19:22,0,71.50.35.97,100,487,1,02/11/2019 19:22,R_tEV7oXhf3QhhQ1b,,,,,40.10830688,-76.51029968,anonymous,EN,,,,Noah,,"4,5,6,7,8,9",1,1,1,2,0,0,40.252,0,,,7,1,0,0,13.146,0,,,7,7,1,2,2,2,1,0,0,36.782,0,,,7,1,0,0,16.399,0,,,7,7,1,,,,,,,,,,,,,,,,,,,,,,,,,,,,,,,,,,,,,,,,,,,36,2,I made my judgements based on the frequency of microwave use Mon-Thurs.,,2,2
02/11/2019 19:14,02/11/2019 19:22,0,24.167.162.47,100,502,1,02/11/2019 19:22,R_31FyK9gxi2m6v00,,,,,36.03219604,-79.8588028,anonymous,EN,,Benjamin,,,,"4,5,6,7,8,9",1,1,1,2,0,0,43.302,0,1,7,,,0,0,18.703,0,1,7,,,1,2,2,2,2,0,0,38.643,0,1,1,,,0,0,20.009,0,6,6,,,1,,,,,,,,,,,,,,,,,,,,,,,,,,,,,,,,,,,,,,,,,,,65,1,"In the first, they did not know each other or when they used the microwave. In the second, they worked in the same office and knew who used the microwave.",,2,1
02/11/2019 19:14,02/11/2019 19:22,0,108.194.200.239,100,498,1,02/11/2019 19:23,R_277FRDoIARrT1pj,,,,,29.54849243,-90.60870361,anonymous,EN,Emma,,,,,"4,5,6,7,8,9",1,1,1,2,0,0,56.734,0,1,7,,,0,0,14.531,0,7,7,,,1,2,2,2,2,36.908,36.908,38.596,1,1,7,,,0,0,15.642,0,7,7,,,1,,,,,,,,,,,,,,,,,,,,,,,,,,,,,,,,,,,,,,,,,,,34,2,I made my judgement based on the information that I had been given.,,1,1
02/11/2019 19:17,02/11/2019 19:23,0,174.101.136.173,100,357,1,02/11/2019 19:23,R_2aEVaQRILuhWe59,,,,,39.13900757,-84.42960358,anonymous,EN,,,Ava,,,"4,5,6,7,8,9",1,1,1,2,0,0,39.436,0,2,7,,,0,0,9.988,0,7,7,,,1,2,2,2,2,10.48,10.48,31.948,1,1,1,,,0,0,13.153,0,7,7,,,1,,,,,,,,,,,,,,,,,,,,,,,,,,,,,,,,,,,,,,,,,,,24,2,I just went with my gut.,,1,1
02/11/2019 19:16,02/11/2019 19:24,0,50.239.137.78,100,477,1,02/11/2019 19:24,R_2eXczmy54SFh9Cj,,,,,36.40280151,-97.86229706,anonymous,EN,,Benjamin,,,,"4,5,6,7,8,9",,,,,,,,,,,,,,,,,,,,,,,,,,,,,,,,,,,,,,,,,,,1,1,2,1,81.568,81.568,118.174,1,,,6,5,9.991,10.583,19.97,2,,,7,7,"1,2",1,1,1,1,7.653,11.267,45.923,2,,,5,6,36.62,36.62,48.313,1,,,7,7,"1,2",29,1,No comments,Nothing,4,2
02/11/2019 19:15,02/11/2019 19:24,0,204.210.117.92,100,553,1,02/11/2019 19:24,R_YWWdtAJmYA0N8hH,,,,,21.29820251,-157.8444061,anonymous,EN,,,,Noah,,"4,5,6,7,8,9",1,1,1,2,8.806,8.806,50.908,1,,,6,2,0,0,16.268,0,,,3,5,1,2,2,2,2,0,0,40.274,0,,,4,4,0,0,21.961,0,,,5,5,1,,,,,,,,,,,,,,,,,,,,,,,,,,,,,,,,,,,,,,,,,,,36,1,"In the second scenario, neither employee knew of the other's microwave habits, so both were equally at fault.  In the first scenario, the person using the microwave the most throughout the week should let the other person use the microwave on friday. ",A little more time to complete the survey as what was listed,1,2
02/11/2019 19:14,02/11/2019 19:26,0,50.49.140.179,100,719,1,02/11/2019 19:26,R_25HgtjFYvdtFm3d,,,,,43.09080505,-77.43479919,anonymous,EN,,Benjamin,,,,"4,5,6,7,8,9",1,1,1,2,0,0,50.321,0,,,7,1,0,0,13.188,0,,,5,5,1,2,2,2,2,0,0,39.082,0,,,1,1,0,0,20.344,0,,,5,5,1,,,,,,,,,,,,,,,,,,,,,,,,,,,,,,,,,,,,,,,,,,,53,1,"Regardless of the expectations of either individual of the other, the concurrent use of the microwaves caused the power failure (even if not intentional).",Quite interesting exercise and visually appealing graphics. Everything worked well.,2,2
02/11/2019 19:19,02/11/2019 19:26,0,76.107.22.101,100,406,1,02/11/2019 19:26,R_sulfwMMndP1yiUF,,,,,35.15719604,-89.92680359,anonymous,EN,,,,,James,"4,5,6,7,8,9",,,,,,,,,,,,,,,,,,,,,,,,,,,,,,,,,,,,,,,,,,,1,1,1,2,11.708,11.708,49.724,1,2,7,,,0,0,18.387,0,2,5,,,1,1,2,2,2,0,0,34.463,0,2,2,,,0,0,16.689,0,2,2,,,1,68,1,"If they knew each other, they should realize that one of them always makes coffee. If they did not know the other's habits, then they would not know that. ",thanks,3,1
02/11/2019 19:14,02/11/2019 19:27,0,76.192.59.220,100,804,1,02/11/2019 19:27,R_3JrRq56c0d8JULm,,,,,42.46220398,-83.3993988,anonymous,EN,,,,,James,"4,5,6,7,8,9",1,1,1,2,0,0,46.553,0,,,7,2,0,0,13.831,0,,,7,2,1,2,2,2,2,29.941,33.976,83.367,2,,,6,2,0,0,31.451,0,,,5,4,1,,,,,,,,,,,,,,,,,,,,,,,,,,,,,,,,,,,,,,,,,,,30,2,Based on who uses the microwave frequently and the fact that they know each other and their behavior or not,,2,2
02/11/2019 19:18,02/11/2019 19:28,0,50.239.137.75,100,612,1,02/11/2019 19:28,R_3nj8kUJgq0Nw4wB,,,,,36.40280151,-97.86229706,anonymous,EN,Emma,,,,,"4,5,6,7,8,9",,,,,,,,,,,,,,,,,,,,,,,,,,,,,,,,,,,,,,,,,,,1,1,1,1,0,0,65.035,0,5,4,,,0,0,21.291,0,5,4,,,1,2,2,2,1,6.481,6.481,46.358,1,4,4,,,0,0,29.649,0,4,4,,,1,29,1,Based on the one who frequently uses the coffee machine.,"No issues.

Good",4,1
02/11/2019 19:20,02/11/2019 19:29,0,172.58.173.118,100,541,1,02/11/2019 19:29,R_2WPBtXAw2CvqfOj,,,,,28.05079651,-82.4484024,anonymous,EN,,,,Noah,,"4,5,6,7,8,9",,,,,,,,,,,,,,,,,,,,,,,,,,,,,,,,,,,,,,,,,,,2,1,1,2,5.83,56.907,57.322,9,6,2,,,6.633,16.858,17.481,8,6,6,,,1,2,1,1,2,4.702,35.629,36.361,14,6,2,,,7.85,15.695,16.592,4,7,2,,,1,34,1,Each person needed to understand the usage of power for their coffee machines.,Thanks,3,1
02/11/2019 19:16,02/11/2019 19:29,0,47.16.153.114,100,781,1,02/11/2019 19:29,R_cAX2ZmitVOL28EN,,,,,40.85650635,-74.12310028,anonymous,EN,,Benjamin,,,,"4,5,6,7,8,9",,,,,,,,,,,,,,,,,,,,,,,,,,,,,,,,,,,,,,,,,,,1,1,1,2,9.115,9.115,52.024,1,,,7,1,0,0,17.315,0,,,4,4,1,2,2,2,2,0,0,32.522,0,,,1,1,0,0,16.399,0,,,4,4,1,36,2,"In the two separate cases, Dan and James frequently made coffee in their respective offices.  However, Dan and Bob and James and Henry, were both at fault on Friday's. They both used more than one coffee maker when they knew the company was implementing Green Friday's.",,3,2
02/11/2019 19:23,02/11/2019 19:30,0,73.214.83.191,100,423,1,02/11/2019 19:30,R_33rtQcbGLptzOLI,,,,,39.6519928,-79.94439697,anonymous,EN,,,,Noah,,"4,5,6,7,8,9",1,1,1,2,0,0,89.953,0,4,4,,,0,0,14.176,0,7,7,,,2,2,2,2,2,26.883,26.883,35.886,1,1,4,,,0,0,71.683,0,7,7,,,1,,,,,,,,,,,,,,,,,,,,,,,,,,,,,,,,,,,,,,,,,,,38,1,It is hard to blame either participant if they did not communicate with each other. ,,1,1
02/11/2019 19:15,02/11/2019 19:30,0,97.76.210.20,100,931,1,02/11/2019 19:30,R_2TFxGKAfmGafyzU,,,,,28.62249756,-81.43170166,anonymous,EN,,,Ava,,,"4,5,6,7,8,9",1,1,1,1,9.7,9.7,44.83,1,1,7,,,0,0,14.376,0,7,7,,,1,2,2,2,1,0,0,34.718,0,1,4,,,0,0,17.841,0,7,7,,,1,,,,,,,,,,,,,,,,,,,,,,,,,,,,,,,,,,,,,,,,,,,37,1,It did not matter who used microwave more frequently before Friday because on Green Friday they are all responsible.,I had no problems with the survey.,1,1
02/11/2019 19:21,02/11/2019 19:31,0,71.185.50.12,100,619,1,02/11/2019 19:31,R_1HjVkygPiFQ5zft,,,,,39.98100281,-75.16989899,anonymous,EN,,,,,James,"4,5,6,7,8,9",1,1,1,2,0,0,38.215,0,2,7,,,18.492,18.492,19.457,1,1,1,,,1,2,2,2,2,0,0,34.158,0,4,4,,,0,0,14.463,0,1,1,,,1,,,,,,,,,,,,,,,,,,,,,,,,,,,,,,,,,,,,,,,,,,,28,1,Neither of these people are at fault for the power outages. This ridiculous company thinks its greener to shut off electricity for the whole building when two appliances on separate floors are being used instead of buying less microwaves and having a common area. ,,1,1
02/11/2019 19:20,02/11/2019 19:32,0,64.20.132.160,100,682,1,02/11/2019 19:32,R_1QKsntTjh6UCh4H,,,,,32.33009338,-80.84349823,anonymous,EN,,,,Noah,,"4,5,6,7,8,9",1,1,1,2,11.149,11.149,50.967,1,1,7,,,0,0,14.52,0,7,7,,,1,2,2,2,2,9.399,9.399,43.701,1,6,3,,,0,0,21.99,0,7,7,,,2,,,,,,,,,,,,,,,,,,,,,,,,,,,,,,,,,,,,,,,,,,,51,2,I made my judgments based on who used the microwave the most and also whether they shared an office the majority of the week (to know whether or not they knew each other's habits. ,Interesting. Thank you for the opportunity.,1,1
02/11/2019 19:19,02/11/2019 19:32,0,71.11.49.14,100,797,1,02/11/2019 19:32,R_2EzBNOUbHqr379n,,,,,34.52510071,-82.63069916,anonymous,EN,Emma,,,,,"4,5,6,7,8,9",,,,,,,,,,,,,,,,,,,,,,,,,,,,,,,,,,,,,,,,,,,1,1,1,2,21.643,21.643,48.112,1,2,7,,,8.626,8.626,20.86,1,2,6,,,1,2,2,2,2,13.858,13.858,37.669,1,2,4,,,0,0,16.237,0,6,6,,,1,29,1,I watched the video and paid attention to the patterns of the two workers. If someone frequently made coffee during the week and then the other person also made coffee on a friday while knowing full well that the other person was going to make coffee then it was their fault.,,4,1
02/11/2019 19:29,02/11/2019 19:34,0,137.25.84.115,100,323,1,02/11/2019 19:34,R_vvLQuyMrSt5tn9f,,,,,33.96870422,-118.0370026,anonymous,EN,,,,Noah,,"4,5,6,7,8,9",,,,,,,,,,,,,,,,,,,,,,,,,,,,,,,,,,,,,,,,,,,1,1,1,2,51.233,52.194,52.401,2,1,7,,,3.6,3.6,15.04,1,7,7,,,1,2,2,2,2,0,0,36.601,0,1,1,,,0,0,19.523,0,7,7,,,1,32,2,They both should've refrained from making coffee on friday. ,,4,1
02/11/2019 19:24,02/11/2019 19:35,0,107.77.217.50,100,659,1,02/11/2019 19:35,R_1omSOwuffwy7BtT,,,,,29.82839966,-95.46959686,anonymous,EN,,Benjamin,,,,"4,5,6,7,8,9",1,1,1,2,0,0,49.068,0,1,7,,,0,0,10.118,0,4,4,,,1,2,2,2,2,0,0,35.692,0,1,1,,,0,0,16.486,0,4,4,,,1,,,,,,,,,,,,,,,,,,,,,,,,,,,,,,,,,,,,,,,,,,,42,1,I don't think either of them were more to blame for the power failure. I blame the company for having that ridiculous policy.,,2,1
02/11/2019 19:28,02/11/2019 19:37,0,74.74.131.154,100,491,1,02/11/2019 19:37,R_3exeMGeocHVI5mQ,,,,,43.13960266,-77.45600128,anonymous,EN,,Benjamin,,,,"4,5,6,7,8,9",,,,,,,,,,,,,,,,,,,,,,,,,,,,,,,,,,,,,,,,,,,1,1,1,2,1.301,16.002,54.459,6,1,7,,,1.325,26.837,28.312,9,1,7,,,1,2,2,2,2,0.964,35.922,36.501,7,4,4,,,9.726,19.215,21.328,4,4,4,,,1,36,2,"With the two coworker who knew each other's schedules, I found there to be more blame because each knew the likelihood of the other making coffee. The two co-workers who didn't know each other's habits I couldn't find fault, not could I really discount that they both caused the power failure because neither knew if the other was likely to make coffee.","None, Thank you. Fun experiment! ",3,1
02/11/2019 19:27,02/11/2019 19:38,0,204.113.88.231,100,617,1,02/11/2019 19:38,R_1hLSBYYQ2QQjXcy,,,,,40.78489685,-111.9337997,anonymous,EN,,Benjamin,,,,"4,5,6,7,8,9",1,1,1,2,0,0,51.474,0,1,7,,,0,0,10.07,0,4,5,,,1,2,2,2,2,0,0,33.036,0,1,4,,,0,0,12.014,0,4,4,,,1,,,,,,,,,,,,,,,,,,,,,,,,,,,,,,,,,,,,,,,,,,,37,1,I decided that the one who used it everyday would be likely to use it on Friday. ,,1,1
02/11/2019 19:31,02/11/2019 19:40,0,104.169.241.127,100,520,1,02/11/2019 19:40,R_1Kr9gY5WYX7M7pd,,,,,45.1230011,-92.53659821,anonymous,EN,Emma,,,,,"4,5,6,7,8,9",,,,,,,,,,,,,,,,,,,,,,,,,,,,,,,,,,,,,,,,,,,1,1,1,2,0,0,47.473,0,1,7,,,0,0,17.025,0,6,6,,,1,2,2,2,2,0,0,56.248,0,1,1,,,0,0,16.697,0,6,6,,,1,37,1,"Seriously, there's no Slack or something for the workers to say, ""making coffee right now on floor 1""?

So, everybody is responsible. ",n/a,4,1
02/11/2019 19:39,02/11/2019 19:40,0,23.81.81.107,100,75,1,02/11/2019 19:40,R_6icUxlmHsao1idX,,,,,33.6730957,-111.9460983,anonymous,EN,,,,noah,,,,,,,,,,,,,,,,,,,,,,,,,,,,,,,,,,,,,,,,,,,,,,,,,,,,,,,,,,,,,,,,,,,,,,,,,,,,,,,,,,,,,,,,,,,,
02/11/2019 19:39,02/11/2019 19:46,0,67.1.254.183,100,403,1,02/11/2019 19:46,R_yyE6L7dbN8k0pkB,,,,,32.18499756,-110.8171005,anonymous,EN,,Benjamin,,,,"4,5,6,7,8,9",1,1,1,2,0,0,55.577,0,,,7,1,0,0,10.246,0,,,5,5,1,2,2,2,2,37.662,37.662,39.228,1,,,4,4,0,0,21.099,0,,,4,4,1,,,,,,,,,,,,,,,,,,,,,,,,,,,,,,,,,,,,,,,,,,,41,1,Eddie and the other one always used the microwave,,1,2
02/11/2019 19:27,02/11/2019 19:49,0,99.102.109.26,100,1319,1,02/11/2019 19:49,R_1K6FuXKkkCkk3bW,,,,,41.79960632,-88.00659943,anonymous,EN,,,,Noah,,"4,5,6,7,8,9",2,2,1,2,0,0,44.653,0,5,3,,,0,0,21.682,0,4,3,,,"1,2",1,1,2,1,50.944,50.944,117.456,1,6,5,,,0,0,19.486,0,7,7,,,1,,,,,,,,,,,,,,,,,,,,,,,,,,,,,,,,,,,,,,,,,,,30,2,looking at the videos and photo of where the microwave was,,2,1
02/11/2019 19:45,02/11/2019 19:57,0,64.203.217.212,100,734,1,02/11/2019 19:57,R_1JF3Vo51Eg1HyT8,,,,,32.3822937,-80.76029968,anonymous,EN,,Benjamin,,,,"4,5,6,7,8,9",1,1,1,2,0,0,45.537,0,,,6,1,0,0,13.904,0,,,6,2,1,2,2,2,2,0,0,39.082,0,,,2,3,0,0,20.15,0,,,6,6,1,,,,,,,,,,,,,,,,,,,,,,,,,,,,,,,,,,,,,,,,,,,37,2,I watched who used the mircowave more during the week.,None,1,2
