04/11/2019 20:34,04/11/2019 20:45,0,76.118.217.197,100,643,1,04/11/2019 20:45,R_2rOBl2GIgLUIkLE,,,,,42.1177063,-72.64450073,anonymous,EN,,,,Noah,,"4,5,6,7,8,9",1,1,1,2,44.311,52.267,52.772,4,5,3,,,6.682,23.559,29.601,8,5,3,,,1,2,2,2,2,2.884,38.034,39.192,2,4,4,,,3.313,3.313,18.34,1,4,4,,,1,,,,,,,,,,,,,,,,,,,,,,,,,,,,,,,,,,,,,,,,,,,36,2,I made them based on common sense. The answers jump out at you really. ,,2,1
04/11/2019 20:41,04/11/2019 20:46,0,73.189.34.112,100,306,1,04/11/2019 20:46,R_tKdSqLWZ66LHCJb,,,,,37.34170532,-121.975296,anonymous,EN,,,,,James,"4,5,6,7,8,9",,,,,,,,,,,,,,,,,,,,,,,,,,,,,,,,,,,,,,,,,,,1,1,1,2,48.051,48.051,48.5,1,,,7,1,0,0,13.307,0,,,7,2,1,2,2,2,2,0,0,33.887,0,,,1,1,0,0,13.362,0,,,7,7,1,30,2,"the first video, the guy knew he made coffee everyday so should have expected it, the second video it was just by chance so they are both at fault",,3,2
04/11/2019 20:36,04/11/2019 20:49,0,75.54.118.10,100,780,1,04/11/2019 20:49,R_1EcXzBZSBtBm19r,,,,,33.95550537,-118.2863007,anonymous,EN,,,,,James,"4,5,6,7,8,9",,,,,,,,,,,,,,,,,,,,,,,,,,,,,,,,,,,,,,,,,,,1,1,1,2,0,0,39.922,0,,,7,2,0,0,17.011,0,,,7,4,1,2,2,2,2,0,0,73.997,0,,,2,2,0,0,14.945,0,,,6,6,1,51,2,"James and Henry don't know each other so there was no way of knowing what the other was going to do. They were both, however, responsible for the power failure just by being ignorant.

Dan and Bob see each other every day, but Bob knew Dan's behavior and I blame Bob for the power failure. ",,4,2
04/11/2019 20:38,04/11/2019 20:50,0,66.171.12.144,100,714,1,04/11/2019 20:50,R_2y7woeDiw6TGX4V,,,,,30.68260193,-94.89880371,anonymous,EN,,Benjamin,,,,"4,5,6,7,8,9",,,,,,,,,,,,,,,,,,,,,,,,,,,,,,,,,,,,,,,,,,,1,1,1,2,0,0,47.775,0,,,4,4,0,0,20.315,0,,,4,4,1,2,2,2,2,0,0,34.418,0,,,6,4,0,0,18.223,0,,,4,4,1,49,1,Neither video provided enough information to make a reasonable assumption of what the other person does on fridays ,,3,2
04/11/2019 20:40,04/11/2019 20:50,0,172.58.75.10,100,590,1,04/11/2019 20:50,R_xnsnTTyODRwiFBT,,,,,36.12199402,-115.0859985,anonymous,EN,,Benjamin,,,,"4,5,6,7,8,9",1,1,1,1,0,0,58.166,0,1,1,,,0,0,13.094,0,6,6,,,1,2,2,2,1,0,0,36.523,0,1,1,,,0,0,24.681,0,6,6,,,1,,,,,,,,,,,,,,,,,,,,,,,,,,,,,,,,,,,,,,,,,,,38,2,"I feel that if no one is suppose to use the microwave on a certain day, then they shouldn't.",none,2,1
04/11/2019 20:38,04/11/2019 20:51,0,97.75.235.140,100,783,1,04/11/2019 20:51,R_1f401NyTSxgBHgE,,,,,32.7118988,-92.09809875,anonymous,EN,,,,Noah,,"4,5,6,7,8,9",1,1,2,2,0,0,50.688,0,1,7,,,0,0,16.191,0,1,5,,,1,2,2,2,2,0,0,35.679,0,1,1,,,0,0,57.452,0,2,1,,,1,,,,,,,,,,,,,,,,,,,,,,,,,,,,,,,,,,,,,,,,,,,37,1,logically if a person could not know another microwave was in use neither one would be the total cause but using the microwave in itself did cause the outage so there still was some blame,,1,1
04/11/2019 20:43,04/11/2019 20:52,0,73.143.198.81,100,524,1,04/11/2019 20:52,R_WjUpGi7nQxmATg5,,,,,41.67390442,-70.19490051,anonymous,EN,,,Ava,,,"4,5,6,7,8,9",1,1,1,2,0,0,52.384,0,7,7,,,0,0,9.952,0,7,7,,,1,1,1,1,1,0,0,32.9,0,7,7,,,4.961,4.961,17.088,1,7,7,,,1,,,,,,,,,,,,,,,,,,,,,,,,,,,,,,,,,,,,,,,,,,,24,1,"i saw the videos and made a judgement
",no problems ,2,1
04/11/2019 20:41,04/11/2019 20:52,0,47.152.98.57,100,661,1,04/11/2019 20:52,R_r8OSuu2St64MUlH,,,,,33.73989868,-117.0150986,anonymous,EN,,,,,James,"4,5,6,7,8,9",,,,,,,,,,,,,,,,,,,,,,,,,,,,,,,,,,,,,,,,,,,1,1,1,2,0,0,58.312,0,1,7,,,0,0,23.104,0,5,6,,,1,2,2,2,1,0,0,43.183,0,1,1,,,0,0,21.61,0,5,5,,,1,33,1,"the first one, neither of them knew the other existed, so they couldn't of made a plan. The second one, bob didn't make coffee all week, then makes it the one day the power can get shut off.",none,4,1
04/11/2019 20:42,04/11/2019 20:54,0,108.70.32.22,100,707,1,04/11/2019 20:54,R_3EbCkKNWjusoXwb,,,,,35.13130188,-84.875,anonymous,EN,,Benjamin,,,,"4,5,6,7,8,9",1,1,1,2,0,0,45.865,0,,,7,1,0,0,13.257,0,,,5,5,1,2,2,2,2,0,0,35.162,0,,,4,4,0,0,17.562,0,,,6,6,1,,,,,,,,,,,,,,,,,,,,,,,,,,,,,,,,,,,,,,,,,,,36,1,"Assuming no conversation was had discussing who would use the microwave Friday, I'd say anyone using it would be at least partly responsible, and all equally so. ",,1,2
04/11/2019 20:53,04/11/2019 20:54,0,50.239.137.40,100,66,1,04/11/2019 20:54,R_3KvVMKj7e9gmpuW,,,,,36.40280151,-97.86229706,anonymous,EN,it's a beautiful,,,,,,,,,,,,,,,,,,,,,,,,,,,,,,,,,,,,,,,,,,,,,,,,,,,,,,,,,,,,,,,,,,,,,,,,,,,,,,,,,,,,,,,,,,,,,,,
04/11/2019 20:44,04/11/2019 20:55,0,173.69.62.51,100,642,1,04/11/2019 20:55,R_0fz4iklnXzMi2xb,,,,,41.77659607,-71.43830109,anonymous,EN,,Benjamin,,,,"4,5,6,7,8,9",,,,,,,,,,,,,,,,,,,,,,,,,,,,,,,,,,,,,,,,,,,1,1,1,2,10.183,10.183,45.676,1,1,6,,,0,0,11.978,0,6,6,,,1,2,2,2,2,0,0,48.447,0,2,2,,,0,0,11.243,0,6,6,,,1,44,2,I tried to think about the prior knowledge that each person had in regards to making coffee and used that information to decide who was to blame.,,4,1
04/11/2019 20:48,04/11/2019 20:55,0,71.28.88.178,100,435,1,04/11/2019 20:55,R_1F4UD99CnYctIvX,,,,,35.13619995,-80.76730347,anonymous,EN,Emma,,,,,"4,5,6,7,8,9",1,1,1,2,0,0,46.445,0,2,7,,,0,0,11.772,0,1,7,,,1,2,2,2,2,0,0,38.065,0,3,2,,,0,0,19.727,0,5,7,,,1,,,,,,,,,,,,,,,,,,,,,,,,,,,,,,,,,,,,,,,,,,,44,1,I made my judgements primarily based on what the workers should have known based on their knowledge of others.,"No, but thanks for the HIT!  I did my best and hope the data is useful!",2,1
04/11/2019 20:48,04/11/2019 20:56,0,172.97.16.228,100,486,1,04/11/2019 20:56,R_0J5WBLYSowgSL9D,,,,,37.73249817,-83.02980042,anonymous,EN,,Benjamin,,,,"4,5,6,7,8,9",,,,,,,,,,,,,,,,,,,,,,,,,,,,,,,,,,,,,,,,,,,1,1,1,2,0,0,47.521,0,,,7,1,0,0,16.054,0,,,7,2,1,2,2,2,2,0,0,39.037,0,,,1,1,0,0,15.338,0,,,4,4,1,39,2,Just by watching the videos and who made coffee the most frequently.,,3,2
04/11/2019 20:44,04/11/2019 20:59,0,5.62.59.51,100,913,1,04/11/2019 20:59,R_1GPvtepMQFH9nNR,,,,,41.82330322,-71.44100189,anonymous,EN,,Benjamin,,,,"4,5,6,7,8,9",1,1,1,2,0,0,99.125,0,,,7,1,0,0,22.938,0,,,7,7,1,2,2,2,2,0,0,85.703,0,,,4,4,36.185,50.721,51.377,2,,,7,7,1,,,,,,,,,,,,,,,,,,,,,,,,,,,,,,,,,,,,,,,,,,,54,2,both employees were responsible for the power cuts in both scenarios because they all used microwaves at the same time,,1,2
04/11/2019 20:51,04/11/2019 21:00,0,24.61.141.136,100,566,1,04/11/2019 21:00,R_9QSc4D7OyeX8bsZ,,,,,42.12879944,-72.57779694,anonymous,EN,Emma,,,,,"4,5,6,7,8,9",1,1,1,2,0,0,73.675,0,1,7,,,0,0,31.814,0,2,6,,,1,2,2,2,2,0,0,55.073,0,1,1,,,0,0,36.062,0,7,7,,,1,,,,,,,,,,,,,,,,,,,,,,,,,,,,,,,,,,,,,,,,,,,44,1,"In the first one, the two guys knew what each other did. I can't remember their names, but guy #2 knew guy #1 used the microwave every day. So he should have known there was a very high probability guy #1 would use the microwave on Friday. In the second scenario neither guy knew anything about the other or their microwave usage.",,1,1
04/11/2019 20:51,04/11/2019 21:01,0,73.63.27.235,100,581,1,04/11/2019 21:01,R_1lcVJ6caXpG7qbp,,,,,40.60380554,-112.0404968,anonymous,EN,,Benjamin,,,,"4,5,6,7,8,9",,,,,,,,,,,,,,,,,,,,,,,,,,,,,,,,,,,,,,,,,,,1,1,1,2,0,0,49.377,0,,,4,4,10.868,10.868,14.11,1,,,4,6,1,2,2,2,2,0,0,32.457,0,,,1,1,0,0,9.691,0,,,1,1,2,41,2,"When the two people are in two separate offices, they cannot be held accountable for knowing each other's routine or for what the other does. ",,3,2
04/11/2019 20:46,04/11/2019 21:03,0,68.51.38.184,100,1014,1,04/11/2019 21:03,R_1mjWlTw9SMHFsyT,,,,,40.74920654,-86.06800079,anonymous,EN,Emma,,,,,"4,5,6,7,8,9",,,,,,,,,,,,,,,,,,,,,,,,,,,,,,,,,,,,,,,,,,,1,1,1,2,11.798,11.798,45.224,1,1,7,,,1.51,1.51,13.11,1,7,7,,,1,2,2,2,2,34.504,34.504,37.341,1,4,4,,,1.08,1.08,15.518,1,7,7,,,1,32,1,I'd look at who used the machine more frequently and who caused outages.,,4,1
04/11/2019 20:57,04/11/2019 21:05,0,68.56.49.129,100,470,1,04/11/2019 21:05,R_01hNIGGQonoJgg9,,,,,42.8697052,-85.66280365,anonymous,EN,,,,Noah,,"4,5,6,7,8,9",1,1,1,2,0,0,43.094,0,1,7,,,0,0,10.605,0,6,7,,,1,2,2,2,2,9.976,9.976,36.685,1,1,4,,,0,0,17.507,0,7,7,,,1,,,,,,,,,,,,,,,,,,,,,,,,,,,,,,,,,,,,,,,,,,,28,2,"I made my judgments based on if the people knew each other and knew what the other person did throughout the day. The first scenario, the people would have no idea what the other does, however in the second they did, so the power failure should not have happened.",,2,1
04/11/2019 20:54,04/11/2019 21:06,0,50.239.137.40,100,734,1,04/11/2019 21:06,R_1He5cUHpSe4FXo5,,,,,36.40280151,-97.86229706,anonymous,EN,,,,,i am,"4,5,6,7,8,9",1,1,1,1,0,0,62.842,0,,,5,6,0,0,21.51,0,,,5,6,1,1,1,1,2,12.725,14.217,39.685,2,,,6,4,0,0,35.2,0,,,5,3,1,,,,,,,,,,,,,,,,,,,,,,,,,,,,,,,,,,,,,,,,,,,29,1,good the video,good,1,2
04/11/2019 20:55,04/11/2019 21:07,0,192.243.109.118,100,679,1,04/11/2019 21:07,R_2SjZzVIktn7Ftkt,,,,,36.16819763,-115.2165985,anonymous,EN,,Benjamin,,,,"4,5,6,7,8,9",,,,,,,,,,,,,,,,,,,,,,,,,,,,,,,,,,,,,,,,,,,1,1,1,2,0,0,44.261,0,,,7,1,0,0,17.292,0,,,7,2,1,2,2,2,2,0,0,37.987,0,,,4,4,0,0,26.601,0,,,3,6,1,34,1,"On one of the videos, the employees worked together and knew each other well. Therefore, it would have been known ahead of time that one employee always uses the coffee pot every day. So, by using it as well on Friday, it was that person's fault for causing the power failure. However, on the other video, the employees did not know each other well and never would have known how often the other uses the coffee machine. So, they share equal blame for the power failure. This is how I made my judgements.",Thank you for the opportunity to participate!,4,2
04/11/2019 21:01,04/11/2019 21:08,0,76.87.178.24,100,425,1,04/11/2019 21:08,R_1QAtf3AtT6MSlL7,,,,,34.60380554,-118.2294998,anonymous,EN,,,,,James,"4,5,6,7,8,9",,,,,,,,,,,,,,,,,,,,,,,,,,,,,,,,,,,,,,,,,,,1,1,1,2,0.952,28.206,54.179,2,1,7,,,0,0,20.025,0,6,7,,,1,2,2,2,2,0,0,41.322,0,4,4,,,5.354,5.354,19.184,1,7,7,,,1,34,1,on the second set neither knew each other routines so the best scenario was not to use the coffee maker on friday. On the first set a routine was established therefore both knew who would use the coffee maker on friday.,,3,1
04/11/2019 21:03,04/11/2019 21:10,0,173.49.1.214,100,427,1,04/11/2019 21:10,R_3eeM2tgLjJr0N6m,,,,,39.93569946,-75.18319702,anonymous,EN,,,,Noah,,"4,5,6,7,8,9",1,1,1,1,0,0,44.129,0,,,7,1,0,0,10.581,0,,,7,7,1,2,2,2,2,0,0,33.9,0,,,4,4,0,0,13.492,0,,,7,7,1,,,,,,,,,,,,,,,,,,,,,,,,,,,,,,,,,,,,,,,,,,,39,2,"Both coworkers  in both sets used the microwaves, and all were aware of the power restrictions. None should have planned on using the microwave on Friday.",,1,2
04/11/2019 21:06,04/11/2019 21:13,0,72.253.228.109,100,415,1,04/11/2019 21:13,R_2xK7EGxvZgg6eT8,,,,,19.58929443,-154.9925995,anonymous,EN,,,,,James,"4,5,6,7,8,9",,,,,,,,,,,,,,,,,,,,,,,,,,,,,,,,,,,,,,,,,,,1,1,1,2,0,0,59.741,0,1,7,,,0,0,18.16,0,2,7,,,1,2,2,2,2,0,0,39.701,0,4,4,,,0,0,22.961,0,7,7,,,1,27,2,"In the first video, the co-workers did not know each other and therefore had no way of predicting the other would make coffee. In the second video, the worker who made coffee on Friday but not the other days knew his coworker would make coffee so he should not have made coffee. ",,4,1
04/11/2019 21:08,04/11/2019 21:16,0,184.103.39.84,100,472,1,04/11/2019 21:16,R_O7sZm1dQPKilZJf,,,,,33.34289551,-111.634697,anonymous,EN,,,Ava,,,"4,5,6,7,8,9",1,1,1,1,4.753,9.895,51.418,2,,,7,1,4.228,5.442,15.819,2,,,5,1,1,2,2,2,1,1.179,3.294,36.03,3,,,1,1,0,0,22.537,0,,,1,1,1,,,,,,,,,,,,,,,,,,,,,,,,,,,,,,,,,,,,,,,,,,,27,1,"In the first video the two employees do not know each other, and therefore do not know each other's habits. Thus, I believe that neither can be blamed for causing the power outage. For the second video, the two employees share an office and they know each other and their habits. Therefore, the one who didn't use the microwave Monday through Thursday, should have known his coworkers would likely be using it on Friday. Therefore, he should not have used it on Friday, and is to blame for the power outage. Though, I didn't assign him complete blame because the company should be held responsible for such a ridiculous policy. ",I thought the survey was great and no improvements are needed. ,2,2
04/11/2019 21:10,04/11/2019 21:18,0,69.133.33.254,100,494,1,04/11/2019 21:18,R_0SPCSbiYK3kBbRD,,,,,39.62440491,-84.37640381,anonymous,EN,,,,Noah,,"4,5,6,7,8,9",,,,,,,,,,,,,,,,,,,,,,,,,,,,,,,,,,,,,,,,,,,1,1,1,2,0,0,48.975,0,1,7,,,0,0,16.071,0,3,6,,,1,2,2,2,2,0,0,34.596,0,4,4,,,0,0,20.483,0,6,6,,,1,57,1,I made judgement based upon whether the person had reason to think the other person either made coffee or they weren't aware in which case they should not assume that the other person would not make coffee.,,3,1
04/11/2019 21:15,04/11/2019 21:23,0,165.231.210.14,100,503,1,04/11/2019 21:23,R_3hrSW6cHj1XgcmB,,,,,32.77670288,-96.80500031,anonymous,EN,,Benjamin,,,,"4,5,6,7,8,9",1,1,1,1,0,0,61.263,0,2,6,,,14.297,14.297,14.774,1,7,7,,,1,2,2,2,2,0,0,86.058,0,1,1,,,0,0,20.32,0,5,5,,,1,,,,,,,,,,,,,,,,,,,,,,,,,,,,,,,,,,,,,,,,,,,25,1,"In the case of Tom, he is very selfish to think Ben won't use the microwave once a week. And Tom's partner should have know Tom is a consistent user of microwave and shouldn't have used it on Friday. Eddie and Neil is unavoidable. ",,1,1
04/11/2019 21:20,04/11/2019 21:28,0,68.227.190.171,100,526,1,04/11/2019 21:28,R_eEcMy2DSS1OeWCR,,,,,41.94839478,-71.41539764,anonymous,EN,Emma,,,,,"4,5,6,7,8,9",1,1,1,2,0,0,43.301,0,1,6,,,0,0,14.4,0,2,6,,,1,2,2,2,2,0,0,38.509,0,2,2,,,0,0,17.491,0,5,5,,,1,,,,,,,,,,,,,,,,,,,,,,,,,,,,,,,,,,,,,,,,,,,40,1,"In the first story, neither person knew what the other was doing on any given day. In the second story, Ben should have expected Tom to use the microwave and planned accordingly.",,2,1
04/11/2019 21:23,04/11/2019 21:30,0,68.111.170.82,100,362,1,04/11/2019 21:30,R_31ocDxwmsFLtkQx,,,,,33.13659668,-117.0610962,anonymous,EN,Emma,,,,,"4,5,6,7,8,9",,,,,,,,,,,,,,,,,,,,,,,,,,,,,,,,,,,,,,,,,,,1,1,1,2,0,0,51.734,0,,,7,1,0,0,20.051,0,,,5,5,1,1,2,2,2,0,0,32.425,0,,,1,1,0,0,15.846,0,,,4,4,1,28,1,"In the first video set, the two employees knew each other, therefore it felt more at fault since they knew who usually has coffee.  In the last video, the two did not know each other's habits at all so the power failure felt more a random chance.",,3,2
04/11/2019 21:25,04/11/2019 21:33,0,76.101.176.65,100,449,1,04/11/2019 21:33,R_29m37bS0dtNhE0w,,,,,25.93339539,-81.6894989,anonymous,EN,Emma,,,,,"4,5,6,7,8,9",,,,,,,,,,,,,,,,,,,,,,,,,,,,,,,,,,,,,,,,,,,1,1,1,2,0,0,48.065,0,,,7,1,0,0,14.686,0,,,7,3,1,2,2,2,2,0,0,36.196,0,,,2,5,0,0,15.723,0,,,4,4,1,40,2,"Since the first two dudes don't know each other well or interact, I figured they'd make assumptions based on their own preferences. In the second scenario, since both dudes knew each other's habits, it was easier to figure out what they'd expect each other to do on Friday. However, it's kind of hard to assign blame when the real fault lies with the company's faulty ""green"" system.",,4,2
04/11/2019 21:28,04/11/2019 21:35,0,24.56.18.8,100,386,1,04/11/2019 21:35,R_3jTD26kyDPm8EPA,,,,,33.66130066,-112.0398026,anonymous,EN,,Benjamin,,,,"4,5,6,7,8,9",,,,,,,,,,,,,,,,,,,,,,,,,,,,,,,,,,,,,,,,,,,1,1,1,2,0,0,57.614,0,,,7,1,0,0,19.316,0,,,7,7,1,2,2,2,2,0,0,38.912,0,,,1,7,0,0,21.138,0,,,7,7,1,35,1,"Based off who always would make coffee, that person should know better than to make coffee on friday.",,4,2
04/11/2019 21:27,04/11/2019 21:36,0,50.239.137.91,100,540,1,04/11/2019 21:36,R_1jZDm1u2Pua5w80,,,,,36.40280151,-97.86229706,anonymous,EN,,,,,James,"4,5,6,7,8,9",1,1,1,2,20.074,20.074,50.256,1,7,7,,,29.518,29.518,31.757,1,2,6,,,1,1,2,2,1,0.89,0.89,43.996,1,7,2,,,3.821,3.821,18.302,1,2,7,,,1,,,,,,,,,,,,,,,,,,,,,,,,,,,,,,,,,,,,,,,,,,,30,1,Based on the which person is doing regular microwave activities,,1,1
04/11/2019 21:29,04/11/2019 21:37,0,98.199.33.227,100,466,1,04/11/2019 21:37,R_RlPT2X3eE1y9WrT,,,,,29.78419495,-95.23010254,anonymous,EN,,,Ava,,,"4,5,6,7,8,9",,,,,,,,,,,,,,,,,,,,,,,,,,,,,,,,,,,,,,,,,,,1,1,1,2,0,0,46.261,0,1,7,,,0,0,14.517,0,4,5,,,1,2,2,2,2,0,0,34.843,0,1,1,,,0,0,14.2,0,1,1,,,1,23,1,"I made the judgements based on how the two coworkers knew each other. Dan and Bob knew each other well, and Bob knew that Dan makes coffee every day. On the other hand James and Henry does not know each other and have no idea of each others coffee drinking.",,3,1
04/11/2019 21:34,04/11/2019 21:45,0,45.31.71.208,100,609,1,04/11/2019 21:45,R_2EntlMIgVCXiTch,,,,,30.11720276,-81.41190338,anonymous,EN,,,,,James,"4,5,6,7,8,9",,,,,,,,,,,,,,,,,,,,,,,,,,,,,,,,,,,,,,,,,,,1,1,1,2,0,0,46.12,0,1,7,,,0,0,15.325,0,5,6,,,1,2,2,2,2,0,0,35.462,0,1,1,,,0,0,16.255,0,6,6,,,1,32,1,"In the first video, James and Henry did not know one another and could not foresee the power cut on Friday. But in the second video, Dan and Bob know one another and shared an office, so Bob should have realized Dan was likely to get coffee when he went to use the machine.",Interesting to take and to think about.,4,1
04/11/2019 21:38,04/11/2019 21:45,0,162.245.132.49,100,398,1,04/11/2019 21:45,R_1hEdmaF557jnUGh,,,,,37.55029297,-77.39420319,anonymous,EN,Emma,,,,,"4,5,6,7,8,9",,,,,,,,,,,,,,,,,,,,,,,,,,,,,,,,,,,,,,,,,,,1,1,1,2,1.909,47.167,47.984,7,1,7,,,14.907,14.907,15.721,1,7,7,,,1,2,2,2,2,1.189,34.71,35.263,3,4,4,,,12.201,12.201,14.542,1,7,7,,,1,25,1,"It takes two to tango. Whether they know each other or not and know the other's behaviors, when they both make coffee, they are equally responsible for the power failure. In both situations, better communication would prevent the problem",,3,1
04/11/2019 21:18,04/11/2019 21:46,0,68.7.221.24,100,1729,1,04/11/2019 21:46,R_27Ik2WqpTZI3I1C,,,,,32.79159546,-116.9710007,anonymous,EN,,,,,James,"4,5,6,7,8,9",,,,,,,,,,,,,,,,,,,,,,,,,,,,,,,,,,,,,,,,,,,1,1,1,2,64.173,64.173,65.06,1,,,7,1,0,0,9.898,0,,,6,2,1,2,2,2,2,0,0,47.024,0,,,7,1,0,0,11.697,0,,,3,5,1,33,1,Just went off the info I had. Mostly just patterns and it was weird that on friday both people who didnt make coffee decided to make it.,,4,2
04/11/2019 21:38,04/11/2019 21:52,0,24.55.114.250,100,841,1,04/11/2019 21:52,R_31yqj0mRtdWhzkH,,,,,18.46859741,-66.10569763,anonymous,EN,,,,Noah,,"4,5,6,7,8,9",,,,,,,,,,,,,,,,,,,,,,,,,,,,,,,,,,,,,,,,,,,1,1,1,1,47.664,47.664,50.058,1,,,7,1,16.986,16.986,18.065,1,,,6,2,1,2,2,2,2,49.254,49.254,50.739,1,,,4,4,14.673,15.245,16.684,2,,,7,7,1,35,2,"In the first set of videos, the co-workers knew each other's routines, therefore, one of them did cause the power outage because the knew their coworker's habit. In the second set of videos, both of them shared equal responsibility for the outage since they did not know each other's habits.",I did not experience any problems or technical difficulties while completing this study.,3,2
04/11/2019 21:26,04/11/2019 21:52,0,160.42.85.9,100,1570,1,04/11/2019 21:52,R_3s4kiqL7ctf3JK6,,,,,30.37730408,-97.70999908,anonymous,EN,,,,,James,"4,5,6,7,8,9",,,,,,,,,,,,,,,,,,,,,,,,,,,,,,,,,,,,,,,,,,,1,1,1,2,104.153,104.496,106.253,2,,,4,4,19.346,21.474,59.063,4,,,5,5,"1,2",2,2,2,2,20.569,20.569,136.12,1,,,3,3,0,0,36.307,0,,,5,5,1,28,2,"Since both people tried to make coffee both times, and caused the power failure, everyone is equally at fault. Even if some people use it more often than others. My first video never loaded though so i didn't see who usually uses it most out of the first group.","my first video never loaded, so I didn't know who used the coffee machine most out of the first group. But then all the others loaded fine, if a little slow.",3,2
04/11/2019 21:39,04/11/2019 21:53,0,71.219.178.179,100,825,1,04/11/2019 21:53,R_1o71gH4d2GAfxGs,,,,,36.65170288,-80.23919678,anonymous,EN,,,,,James,"4,5,6,7,8,9",1,1,1,2,19.277,19.277,66.505,1,1,7,,,0,0,14.063,0,7,7,,,1,2,2,2,2,0,0,44.726,0,1,1,,,13.359,13.359,31.005,1,7,7,,,1,,,,,,,,,,,,,,,,,,,,,,,,,,,,,,,,,,,,,,,,,,,48,2,BY WHAT I OBSERVED IN THE VIDEOS,,2,1
04/11/2019 21:30,04/11/2019 21:56,0,159.53.78.141,100,1576,1,04/11/2019 21:56,R_2QQCVd2mm6SwWLz,,,,,40.74940491,-73.96640015,anonymous,EN,Emma,,,,,"4,5,6,7,8,9",1,1,1,2,0,0,35.145,0,,,7,1,0,0,11.009,0,,,4,4,1,2,2,2,2,0,0,38.121,0,,,7,1,0,0,15.157,0,,,4,4,1,,,,,,,,,,,,,,,,,,,,,,,,,,,,,,,,,,,,,,,,,,,30,1,"I figured that the premise was that sicne one person used the microwave all week without issue, and then on Friday when they both used it and it caused a power failure, technically you could say that the more infrequent person using the microwave is the one that caused the issuue. ",,2,2
04/11/2019 21:50,04/11/2019 21:57,0,172.220.143.56,100,415,1,04/11/2019 21:57,R_1ff0lIwr2nXr3lg,,,,,35.73190308,-81.70909882,anonymous,EN,,,,Noah,,"4,5,6,7,8,9",,,,,,,,,,,,,,,,,,,,,,,,,,,,,,,,,,,,,,,,,,,1,1,1,2,0,0,32.985,0,6,7,,,9.898,9.898,10.456,1,7,7,,,1,2,2,2,2,0,0,33.071,0,3,7,,,0,0,10.091,0,3,7,,,1,26,1,I based my decisions on who used the coffee more. ,,4,1
04/11/2019 21:54,04/11/2019 22:05,0,64.9.249.153,100,626,1,04/11/2019 22:05,R_12gqCinigatpcRX,,,,,40.76530457,-73.95890045,anonymous,EN,,,Ava,,,"4,5,6,7,8,9",,,,,,,,,,,,,,,,,,,,,,,,,,,,,,,,,,,,,,,,,,,1,1,1,2,0,0,49.68,0,1,7,,,0,0,13.807,0,1,6,,,1,2,2,2,2,0,0,37.539,0,1,1,,,0,0,16.806,0,6,6,,,2,48,1,In the second scenario the person could predict the other's behavior. They knew they could cause a power failure by changing their routine.,n/a,4,1
04/11/2019 22:03,04/11/2019 22:14,0,99.1.189.33,100,671,1,04/11/2019 22:14,R_vHLpdkMP5P0BJLj,,,,,33.64320374,-83.9681015,anonymous,EN,,,,,James,"4,5,6,7,8,9",,,,,,,,,,,,,,,,,,,,,,,,,,,,,,,,,,,,,,,,,,,1,1,1,2,31.881,40.792,74.938,3,,,7,1,5.88,5.88,9.459,1,,,4,1,1,2,2,2,2,74.638,77.088,78.217,3,,,1,4,14.418,14.418,15.598,1,,,1,1,"1,2",32,2,"On the first video, I believe it would be difficult to know who would use the coffee maker as the coworkers are unaware of each other's actions.  However, the second video makes it clear that Dan uses the coffee maker often and Bob should be aware of this, seeing that he would be aware of Dan's use of the coffee maker during the week.",N/A,4,2
04/11/2019 21:59,04/11/2019 22:17,0,75.44.32.32,100,1059,1,04/11/2019 22:17,R_1l4aezhYqOuitsB,,,,,43.16009521,-87.99440002,anonymous,EN,Emma,,,,,"4,5,6,7,8,9",1,1,1,2,21.492,34.077,75.535,3,,,7,1,0,0,17.338,0,,,6,2,1,2,2,2,2,0,0,48.838,0,,,1,1,15.3,15.3,39.817,1,,,4,4,1,,,,,,,,,,,,,,,,,,,,,,,,,,,,,,,,,,,,,,,,,,,58,2,"I no longer remember what I put about whether Eddie and Neil expect each other to use microwaves. I probably said that I did not. I thought that was an odd question. On whether either Eddie or Neil caused the power outage, that question did not make any sense to me as it had to be both of them in order to cause the power outage. I put No Opinion because it seemed unanswerable. I said that as far as I knew Ben did expect Tom to the use the microwave and Tom did not expect Ben to use the microwave, because I knew Ben saw Tom use the microwave every day and Ben did not use the microwave every day. On who caused the power outage, it seemed like Ben did because he knew it would be a second microwave and did it anyway, even through carelessness, it seemed like a cause. However it still took both microwaves so I marked the points down slightly.","I got a bit stuck on why everyone has their own microwave, how many there might be in the building, and common sense objections like that. Two or more of the videos took long enough to load that I was clicking on them and clicking the play / pause button. Probably I should have waited longer.",2,2
04/11/2019 22:09,04/11/2019 22:19,0,174.50.68.76,100,575,1,04/11/2019 22:19,R_3hoMsR18Kq0rlQ0,,,,,35.08129883,-106.6212006,anonymous,EN,,,,,James,"4,5,6,7,8,9",1,1,1,2,0,0,56.466,0,1,7,,,0,0,16.739,0,4,4,,,1,2,2,2,2,0,0,39.64,0,4,4,,,0,0,27.435,0,4,4,,,1,,,,,,,,,,,,,,,,,,,,,,,,,,,,,,,,,,,,,,,,,,,24,2,"In the first video, one coworker used the microwave every single day, so his colleague should have expected he'd use it Friday and try to coordinate their microwaving. That said, it's not really either of their fault - there's no system in place for them to know if anyone else is using a microwave, including the two microwaves in their usual office. For the second video, neither coworker could know anything about their colleague's microwaving habits. For both scenarios, the moronic building manager is at fault. I'm sure having to cut the power back on every Friday is really saving those emissions...","None, thanks. Have a great week!",1,1
04/11/2019 22:19,04/11/2019 22:23,0,107.137.132.222,100,240,1,04/11/2019 22:23,R_1CCPzRAvtJEmX0c,,,,,29.88340759,-95.45529938,anonymous,EN,,Benjamin,,,,"4,5,6,7,8,9",1,1,1,2,0,0,31.996,0,,,3,6,0,0,12.09,0,,,6,3,2,1,1,1,1,0,0,33.658,0,,,5,4,0,0,16.54,0,,,2,6,1,,,,,,,,,,,,,,,,,,,,,,,,,,,,,,,,,,,,,,,,,,,30,1,The person that used it the most was the one I considered the cause of the power failure. ,,2,2
04/11/2019 22:02,04/11/2019 22:27,0,97.73.85.25,100,1501,1,04/11/2019 22:27,R_wY8ZVGqMwkUNhHX,,,,,37.75100708,-97.8219986,anonymous,EN,Emma,,,,,"4,5,6,7,8,9",,,,,,,,,,,,,,,,,,,,,,,,,,,,,,,,,,,,,,,,,,,1,1,1,2,117.504,117.504,118.432,1,2,6,,,110.705,124.898,140.114,3,3,5,,,1,2,2,2,2,94.799,94.799,95.597,1,4,4,,,45.359,45.359,46.075,1,5,5,,,1,35,2,"I felt that if people did not know how the other behaves, the default is to assume they will use the coffee machine.  In the first scenario, it was known that one party would use the coffee machine every day, so the person who used it infrequently was to blame.",A3POD149IG0DIW,3,1
04/11/2019 22:17,04/11/2019 22:32,0,24.162.109.249,100,857,1,04/11/2019 22:32,R_2RVSK3qxFAmsM2T,,,,,31.06820679,-97.39199829,anonymous,EN,,,Ava,,,"4,5,6,7,8,9",,,,,,,,,,,,,,,,,,,,,,,,,,,,,,,,,,,,,,,,,,,1,1,1,2,0,0,47.346,0,,,7,1,0,0,14.734,0,,,7,7,1,2,2,2,2,0,0,42.331,0,,,1,1,0,0,16.401,0,,,7,7,1,23,1,"Well, my judgement was that anybody using the coffee machine is at fault even if there is one allowed use of it. To be on the safe side, nobody should make coffee on Friday and if you do you and whoever else makes coffee is equally at fault.",,4,2
